firstName,lastName,teacherId,department,schoolName,class,date,reviewId,clarityRating,difficultyRating,helpfulRating,wouldTakeAgain,textbookUse,comment,ratingTags,teacherNote,grade,attendanceMandatory,isForCredit,isForOnlineClass,thumbs,thumbsDownTotal,thumbsUpTotal
Andrew,Watson,VGVhY2hlci0xOTY1OTU4,Communication,Brigham Young University,318,2014-12-17 17:46:54 +0000 UTC,UmF0aW5nLTI0MTIyNDEz,5,2,5,,1,"Andy is one of the best professors I have ever had at BYU. He really cares about his students and wants them to succeed. He also gives a lot of real world advice about how to get a job and improve your resume. I highly recommend taking a class from him, you won&#39;t regret it. ",,,,,True,False,[],0,1
William,Lund,VGVhY2hlci0xOTY2MDU2,Computer Science,Brigham Young University,CS 142,2015-10-22 14:15:28 +0000 UTC,UmF0aW5nLTI1MjgwOTM2,1,5,1,,3,"He is super unclear, and in order to pass this intro class, you pretty much have to a programming master already. Good luck.",,,,,True,False,[],1,2
William,Lund,VGVhY2hlci0xOTY2MDU2,Computer Science,Brigham Young University,CS142,2014-12-17 19:44:13 +0000 UTC,UmF0aW5nLTI0MTI0MDQz,4,1,4,,4,Dr. Lund was a good professor. He gave quizzes in class graded on completion and was good at explaining the concepts. The TAs for this course are really what saves you. Do yCode and the labs on time and it&#39;s really fun. You&#39;ll learn so much.,,,,,True,False,[],0,1
Sunbeam,Choi,VGVhY2hlci0xOTY3MjM4,Music,Brigham Young University,PIANO160,2014-12-19 04:08:14 +0000 UTC,UmF0aW5nLTI0MTQzMzE4,5,2,5,,5,"Professor Choi is a great instructor. If you practice the pieces he tells you to, then you&#39;ll pass with an A. Be sure to attend ALL of your classes though. Attendance is a must since he&#39;s pretty hard to get to reschedule your time. He&#39;s very friendly and willing to help.",,,,,True,False,[],0,1
Steven,Sondrup,VGVhY2hlci0xOTY4NDE3,Scandinavian,Brigham Young University,SCAND430,2020-01-21 20:44:34 +0000 UTC,UmF0aW5nLTMyODU1NDcw,2,3,2,0.0,0,"The lectures Sondrup give are straight off of Wikipedia. As 90% of this class is lecture-based with a midterm and a final to close it out, I would highly recommend not taking this class unless you need to. There are far better and more interesting professors in the Scandinavian department. As a teacher, I would not rate him very highly.",Graded by few things--Lecture heavy,,B,non mandatory,True,False,[],0,0
Steven,Sondrup,VGVhY2hlci0xOTY4NDE3,Scandinavian,Brigham Young University,SCAND430,2015-06-25 19:34:16 +0000 UTC,UmF0aW5nLTI0OTk2NTU4,3,4,4,,5,"You needed to read and show up for class discussion, not because it was required in the grade (I believe), but because an understanding for the tests came from the reading and discussion",,,A,non mandatory,True,False,[],0,0
Steven,Sondrup,VGVhY2hlci0xOTY4NDE3,Scandinavian,Brigham Young University,SCAND430,2014-12-21 13:52:26 +0000 UTC,UmF0aW5nLTI0MTYxMzk4,3,5,2,,4,"Professor Sondrup is a very nice, incredibly intelligent and very knowledgeable old man. But you should only take his class if you 1. Have nothing else going on in your life 2. You&#39;ve read the texts before 3. You don&#39;t care about your grade andor 4. Your readingopinion of the texts is exactly the same as his reading. 25+ long, intense texts. ",,,,,True,False,[],0,0
Marcy,Fetzer,VGVhY2hlci0xOTY4NjM3,Communication,Brigham Young University,ORGB321,2016-03-30 02:40:11 +0000 UTC,UmF0aW5nLTI2MjAyNDU5,3,3,3,,5,"She&#39;s an awesome teacher. She uses lots of personal examples to explain concepts. You need to read the textbook. Daily reading quizzes.  About 80% of her test questions are super easy, and the other 20% just leave you wondering where the heck that information was. All in all, a good, fun class.",,,,,True,False,[],0,0
Marcy,Fetzer,VGVhY2hlci0xOTY4NjM3,Communication,Brigham Young University,ORGB320,2016-01-04 14:23:48 +0000 UTC,UmF0aW5nLTI1ODcxNjQz,4,2,5,,4,"Professor Fetzer&#39;s class is really easy. I put in pretty minimal effort and got a pretty good grade. She was super nice and lenient for me on turning in an assignment late when I was stuck in a blizzard one weekend. Nothing is graded too difficult, but this was her first semester at BYU teaching so it may change.",,,A-,non mandatory,True,False,[],0,0
Marcy,Fetzer,VGVhY2hlci0xOTY4NjM3,Communication,Brigham Young University,MCOM320,2015-12-02 23:37:07 +0000 UTC,UmF0aW5nLTI1NTMyOTUw,5,3,5,,4,Professor Fetzer is awesome. Very helpful. ,,,A-,mandatory,True,False,[],0,0
Marcy,Fetzer,VGVhY2hlci0xOTY4NjM3,Communication,Brigham Young University,OB321,2015-11-06 13:03:36 +0000 UTC,UmF0aW5nLTI1MzU4NjMy,4,2,4,,5,"She definitely expects her students to come to class prepared, and if you do the work (which really isn&#39;t bad at all and she&#39;s very fair/understanding with the workload), class is very interesting and engaging due to her experience and research in the field. Definitely learned a lot. READING IS A MUST.",,,A,,True,False,[],0,0
Sara,Phenix,VGVhY2hlci0xOTY4NzA1,French  Italian,Brigham Young University,FRENCH321,2020-09-01 03:17:11 +0000 UTC,UmF0aW5nLTMzNjIzODk2,5,3,5,1.0,5,"Dr. Phenix is AMAZING. One of my favorite professors ever. I highly recommend taking her class, she cares so much about her students and is SO fun.",Respected--Accessible outside class--Amazing lectures,,A,mandatory,True,False,[],0,0
Sara,Phenix,VGVhY2hlci0xOTY4NzA1,French  Italian,Brigham Young University,FREN362,2020-08-18 16:54:56 +0000 UTC,UmF0aW5nLTMzNTk1MzQy,4,4,4,1.0,5,It was a Good class but might have been different because of COVID but lectures we kind of pointless. Lots of writing in the class which is challenging but Madame Phenix is always willing to help and gives good feedback.,Gives good feedback--Lots of homework--Get ready to read,,A,,True,False,[],0,0
Sara,Phenix,VGVhY2hlci0xOTY4NzA1,French  Italian,Brigham Young University,FREN362,2020-06-22 21:04:48 +0000 UTC,UmF0aW5nLTMzNDU1NDE0,5,3,5,1.0,5,"I adore Dr. Phenix. She cares greatly for her students and is always willing to help during the writing process. There was a lot of reading, but honestly some of it could be skimmed. The reading quizzes weren&#39;t worth much anyways. I highly recommend her and this class.",Gives good feedback--Respected,,A,mandatory,True,True,[],0,0
Sara,Phenix,VGVhY2hlci0xOTY4NzA1,French  Italian,Brigham Young University,FRENCH362,2020-04-28 02:09:40 +0000 UTC,UmF0aW5nLTMzMTQzNjY1,5,4,5,1.0,5,"Dr Phenix is incredible. I hate history classes usually, but she made French history soo interesting. She is hilarious as well. A TON of reading for the class with reading quizzes in class most days, but she does it so that the discussions can be amazing. The test is a lot of writing and there is a 10 page paper at the end, but she helps so much :)",Get ready to read--Hilarious--Amazing lectures,,A,mandatory,True,False,[],0,0
Sara,Phenix,VGVhY2hlci0xOTY4NzA1,French  Italian,Brigham Young University,FREN362,2020-04-08 08:21:48 +0000 UTC,UmF0aW5nLTMzMDMzNzQy,4,4,4,1.0,5,"There&#39;s a lot I admire about Dr. Phenix. Her compassion for her students and her passion for her subject are at the top of the list. While the concept of studying largely from primary sources is great for authenticity, it&#39;s less great for college students doing a number of other demanding classes. FYI, she will catch your every grammatical mistake.",Get ready to read--Skip class? You won't pass.--Beware of pop quizzes,,,mandatory,True,False,[],0,0
Sara,Phenix,VGVhY2hlci0xOTY4NzA1,French  Italian,Brigham Young University,FRENCH321,2020-04-05 01:40:49 +0000 UTC,UmF0aW5nLTMzMDIwNzQ4,5,3,5,1.0,5,"If you plan on taking French 321, take it from Dr. Phenix. She is amazing, and although French 321 is a hard class, she makes it very doable. She constantly offers to meet with students outside of class and is willing to help out in any way she can. Take it from her! You won&#39;t regret it!",Gives good feedback--Accessible outside class--Caring,,Not sure yet,mandatory,True,False,[],0,0
Sara,Phenix,VGVhY2hlci0xOTY4NzA1,French  Italian,Brigham Young University,FREN362,2020-04-01 04:45:57 +0000 UTC,UmF0aW5nLTMzMDA5NzMx,4,4,4,1.0,5,"SO. MUCH. READING. She uses primary sources, which is really cool, but also takes so long, and she quizzes you on it. A lot of really good content in lectures but she doesn&#39;t post her slides or notes, so make sure to take your own. Long papers and group projects. TBH it&#39;s a toss-up if I would do it again.",Lots of homework--Participation matters--Group projects,,,mandatory,True,False,[],0,0
Sara,Phenix,VGVhY2hlci0xOTY4NzA1,French  Italian,Brigham Young University,FRENCH211,2019-04-19 19:53:27 +0000 UTC,UmF0aW5nLTMxNjMxNDA2,5,2,5,1.0,5,"Coming from 4 years of high school french and a semester of French 202, this class was not hard. Speaking tests make up a good portion of your grade, but if you prepare, she is not too hard of a grader. I probably spend 3 hours a week outside of class doing HW, preparing for tests, etc.",Clear grading criteria--Hilarious--Caring,,A,mandatory,True,False,[],0,0
Sara,Phenix,VGVhY2hlci0xOTY4NzA1,French  Italian,Brigham Young University,FREN321,2019-04-16 01:26:49 +0000 UTC,UmF0aW5nLTMxNjAwMDg5,4,4,4,1.0,5,"Dr. Phenix is great and makes class interesting, but the class is tough.",Gives good feedback--Participation matters,,A,mandatory,True,False,[],0,0
Sara,Phenix,VGVhY2hlci0xOTY4NzA1,French  Italian,Brigham Young University,FRENCH321,2019-03-31 01:37:50 +0000 UTC,UmF0aW5nLTMxNTAzOTA2,4,4,4,1.0,5,"Professor Phenix is very good at teaching French and makes the rigorous requirements set forth by the Department as straightforward as possible, and she does her best to make it enjoyable as well.",Lots of homework--Hilarious--Beware of pop quizzes,,A,mandatory,True,False,[],0,0
Sara,Phenix,VGVhY2hlci0xOTY4NzA1,French  Italian,Brigham Young University,FREN453R,2018-12-20 02:41:25 +0000 UTC,UmF0aW5nLTMxMTA5Njkz,4,4,4,1.0,5,"Professor Phenix is a great teacher - she is highly knowledgable about her subject areas and includes students in the lectures. This course requires lots of reading, but she makes it very interesting. She can be very intimidating. She grades you on the harsher end, but gives helpful feedback. She also is readily available outside of class if needed",Gives good feedback--Get ready to read--Amazing lectures,,,non mandatory,True,False,[],0,0
Sara,Phenix,VGVhY2hlci0xOTY4NzA1,French  Italian,Brigham Young University,FRENCH321,2017-10-20 07:02:35 +0000 UTC,UmF0aW5nLTI4NzY0Mjgw,5,3,5,1.0,5,"Dr. Phenix was great. Her class was very enjoyable and she puts in a lot of effort to make it fun. I learned a lot in her class and I&#39;m so excited to take 322 from her. Her tests are fair. There are some tricky questions, but I feel like you&#39;ll get that no matter what class you take. WOULD HIGHLY RECOMMEND.",Gives good feedback--Participation matters--Clear grading criteria,,A-,mandatory,True,False,[],0,0
Sara,Phenix,VGVhY2hlci0xOTY4NzA1,French  Italian,Brigham Young University,FRENCH321,2016-12-30 15:48:33 +0000 UTC,UmF0aW5nLTI3NjQ2NDU3,5,3,5,1.0,5,"Madame Phenix is awesome! She is one of my favorite professors ever and this was one of my favorite classes ever. She is HILARIOUS and class is tons of fun. She makes learning enjoyable. It was definitely work, but she is very helpful and clear.",Gives good feedback--Hilarious,,,,True,False,[],0,0
Sara,Phenix,VGVhY2hlci0xOTY4NzA1,French  Italian,Brigham Young University,FRENCH322,2016-12-01 12:34:28 +0000 UTC,UmF0aW5nLTI3Mjk4NjQ4,5,4,5,1.0,5,"Dr. Phenix is AWESOME. I&#39;ve had her for 321 and 322, and she is by far my favorite professor. As long as you pay attention and do your work, she&#39;s pretty clear on everything, and she&#39;s great at helping you understand French concepts and grading criteria. Class is also super fun and you&#39;d have to make an effort to NOT learn anything in her class.",Gives good feedback--Clear grading criteria--Hilarious,,A,mandatory,True,False,[],0,0
Sara,Phenix,VGVhY2hlci0xOTY4NzA1,French  Italian,Brigham Young University,FRENCH321,2016-10-24 22:18:14 +0000 UTC,UmF0aW5nLTI3MDczMzY4,5,3,5,1.0,5,I think she is one of the best professors on campus. I had so much fun in her class! She loves to have a good time and make jokes. We were never bored! She knows the coursework can be monotonous so she would put a fun twist on things to make it more entertaining. I am going to try to keep taking classes from her as long as I can.,Gives good feedback--Hilarious--Caring,,A+,mandatory,True,False,[],0,0
Sara,Phenix,VGVhY2hlci0xOTY4NzA1,French  Italian,Brigham Young University,FREN362,2016-04-14 21:09:55 +0000 UTC,UmF0aW5nLTI2MzAxMTkz,5,3,5,,5,"Loved this class. Clear expectations, interesting assignments, great in-class discussion. Uses many types of media to make class engaging. Really cares for the students and thinks about their needs. Manageable workload.",,,,mandatory,True,False,[],0,0
Sara,Phenix,VGVhY2hlci0xOTY4NzA1,French  Italian,Brigham Young University,FRENCH321,2016-03-31 21:54:34 +0000 UTC,UmF0aW5nLTI2MjEzNjg5,5,3,5,,4,"Dr. Phenix is the coolest professor ever. She always make her classes engaging and fun. I would definitely take courses with her if I could. She does assign small homework assignments after every class but they aren&#39;t too hard to stay on top of. Also she is so hilarious. If you try your best, she will appreciate your efforts.",,,A,mandatory,True,False,[],0,0
Sara,Phenix,VGVhY2hlci0xOTY4NzA1,French  Italian,Brigham Young University,FREN362,2016-03-29 12:57:18 +0000 UTC,UmF0aW5nLTI2MTk3MjE3,4,3,4,,4,She does everything she can to make it interesting and she&#39;s very clear.  It&#39;s predictable what is on the tests.  There is a lot of reading but it ends up being useful and she&#39;s very entertaining.,,,A-,mandatory,True,False,[],0,0
Sara,Phenix,VGVhY2hlci0xOTY4NzA1,French  Italian,Brigham Young University,FREN321,2015-11-19 19:41:26 +0000 UTC,UmF0aW5nLTI1NDU2MjI5,4,3,5,,5,"Professor Phenix is awesome! She is engaging and ABSOLUTELY hilarious. I was never bored in her class. She is really good at helping you understand grammar concepts. Your grade is pretty dependent upon being in class, participating and doing your homework. I would totally recommend Prof. Phenix!",,,A-,mandatory,True,False,[],0,0
Sara,Phenix,VGVhY2hlci0xOTY4NzA1,French  Italian,Brigham Young University,FREN321,2015-11-10 16:00:47 +0000 UTC,UmF0aW5nLTI1MzgyNjAy,5,3,5,,4,The best thing about this class is that Prof Phenix is willing to meet with us and help us figure things out. She also makes grammar concepts really clear. Class is fun to go to. A lot of speaking practice.,,,A-,,True,False,[],0,0
Sara,Phenix,VGVhY2hlci0xOTY4NzA1,French  Italian,Brigham Young University,FREN321,2015-11-03 17:53:04 +0000 UTC,UmF0aW5nLTI1MzM0OTE1,5,3,5,,4,"Professor Phenix is new, so she doesn&#39;t have a lot of ratings, but I thought I would give one because there is only 1 review. She is a really dynamic teacher and made grammar (which I am NOT into) easy to understand. She had fun activities and gave helpful feedback.  I HIGHLY recommend her for 321!!! oh, and she speaks like a native.",,,B+,mandatory,True,False,[],0,0
Sara,Phenix,VGVhY2hlci0xOTY4NzA1,French  Italian,Brigham Young University,FRENCH321,2014-12-22 01:33:34 +0000 UTC,UmF0aW5nLTI0MTY1NTg5,3,3,3,,4,"Prof Phenix is really a good person and a solid teacher. The curriculum makes it tough to teach to the students needs and take time on the more difficult concepts, but she did her best to help out when she could. The tests were hard but fair. She can be a tough grader but she&#39;s willing to help and explain to you where you went wrong. I&#39;d recommend",,,,,True,False,[],0,0
Elizabeth ,Kraczek ,VGVhY2hlci0xOTcwNTYw,Physics  Astronomy,Brigham Young University,PHYS127,2016-02-26 18:25:51 +0000 UTC,UmF0aW5nLTI2MDkyMDIw,4,2,3,,1,"Dr. Kraczek was a pretty good professor! Her lectures were interesting and well prepared. Tests weren&#39;t very difficult with a little bit of studying beforehand. Attendance in mandatory so take it at a time that works well for you. The textbook isn&#39;t required, just buy the workbook and you&#39;ll be fine.",,,A,mandatory,True,False,[],0,0
Elizabeth ,Kraczek ,VGVhY2hlci0xOTcwNTYw,Physics  Astronomy,Brigham Young University,PHSC127,2016-02-22 11:03:15 +0000 UTC,UmF0aW5nLTI2MDc1NDk3,5,3,5,,5,Great teacher and class! There are outside work that  takes a while so be prepared!,,,B+,mandatory,True,False,[],0,0
Elizabeth ,Kraczek ,VGVhY2hlci0xOTcwNTYw,Physics  Astronomy,Brigham Young University,PHSCS127,2015-12-16 03:02:34 +0000 UTC,UmF0aW5nLTI1NzE5MDk5,5,2,5,,3,"Dr. Kraczek was one of my favorite professors at BYU. She is so intelligent and knows so much, but she is so good at simplifying everything and making it easy to understand. She is great at answering questions and willing to help. This class was so interesting, and I loved it. It&#39;s really not very hard, but it went way more in-depth than I thought.",,,A+,mandatory,True,False,[],0,0
Elizabeth ,Kraczek ,VGVhY2hlci0xOTcwNTYw,Physics  Astronomy,Brigham Young University,PHSC127,2015-12-10 14:53:20 +0000 UTC,UmF0aW5nLTI1NjI5MTU2,3,3,4,,2,This class was so testimony building. It doesn&#39;t require a lot of math and is for non-majors as well. The class was super interesting and awe inspiring. I honestly think it should be a requirement for religion. Sometimes the tests and quizzes didn&#39;t quite match up to what was covered in the lecture. Overall a great class.,,,B+,mandatory,True,False,[],0,0
Elizabeth ,Kraczek ,VGVhY2hlci0xOTcwNTYw,Physics  Astronomy,Brigham Young University,PHSCS127,2015-11-19 19:28:02 +0000 UTC,UmF0aW5nLTI1NDU2MTIz,5,3,5,,3,This is a great class and Dr. Kraczek is probably one of the best professors I&#39;ve had as far as teaching methodology. She uses lecture tutorials (workbook) in class for better student retention and asks multiple choice questions in class to make sure everyone understands before moving on. Tests are moderately difficult because this is science. ,,,A-,mandatory,True,False,[],0,0
Elizabeth ,Kraczek ,VGVhY2hlci0xOTcwNTYw,Physics  Astronomy,Brigham Young University,PHYS127,2015-09-02 01:36:59 +0000 UTC,UmF0aW5nLTI1MTY2NjEz,4,2,5,,2,"After taking this class you&#39;ll always be looking at the sky. I loved this class and as long as you make an effort to pay attention, you&#39;ll get a good grade. She&#39;ll stop and ask quick questions to make sure concepts are understood. Willing to go over things again if you don&#39;t understand. Totally recommend this class! You only need to buy the wrkbook",,,A-,mandatory,True,False,[],0,0
Elizabeth ,Kraczek ,VGVhY2hlci0xOTcwNTYw,Physics  Astronomy,Brigham Young University,PHSC127,2015-03-31 11:42:28 +0000 UTC,UmF0aW5nLTI0NTI0Nzg4,4,5,4,,3,"Loved the class and the ciriculum, it was just VERY difficult. Even though I studied all the time and got good grades on the HW (which is very time consuming), I failed almost every test and the final was ridiculous. She&#39;s an amazing lecturer and the content was fantastic, but the tests and homework are ridiculously difficult ",,,D+,mandatory,True,False,[],0,0
Elizabeth ,Kraczek ,VGVhY2hlci0xOTcwNTYw,Physics  Astronomy,Brigham Young University,PHSCS127,2014-12-28 01:11:01 +0000 UTC,UmF0aW5nLTI0MTk1MTIw,5,2,5,,2,Kraczek is such an amazing professor! Easily my favorite class taken at BYU. Her lectures are easy to follow and powerpoints are posted online for your access. She takes everything really slow and weekly homework assignments are allowed two tries. She does such a good job lecturing tests are not difficult. Best class ever! Take it!!!! ,,,,,True,False,[],0,1
Cynthia,Wallin,VGVhY2hlci0xOTcwNTcy,Management,Brigham Young University,BUSM466,2016-12-26 13:27:45 +0000 UTC,UmF0aW5nLTI3NjI0MjY4,2,3,2,0.0,0,"Definitely exam heavy. The class average was too high, so she wrecked us all with a devastating final. So be prepared for that. Other than that the class was average, all of your assignments will be papers. Start them as soon as you can.",Participation matters--TEST HEAVY--GRADED BY FEW THINGS,,A-,mandatory,True,False,[],0,0
Carter,Rees,VGVhY2hlci0xOTcwODcx,Sociology,Brigham Young University,SOC307,2016-05-05 17:08:43 +0000 UTC,UmF0aW5nLTI2NDgwODA4,5,4,5,,0,Great guy. Makes you think and work but it&#39;s fun at the same time. Gives you the confidence to do something new and believe you can do it. I&#39;m glad to be done with 307 but I did enjoy it while it lasted.,,,A-,mandatory,True,False,[],0,2
Carter,Rees,VGVhY2hlci0xOTcwODcx,Sociology,Brigham Young University,SOC383,2016-03-31 12:37:42 +0000 UTC,UmF0aW5nLTI2MjEwMTM3,5,1,4,,1,"Dr. Rees is the man! He basically let us create our own syllabus at the beginning of the year (so that we wouldn&#39;t complain because we chose it). His tests are SO easy if you just study your lecture notes. Halfway through I stopped doing the readings because thats all we talk about in class, so you don&#39;t really need the books. Brings donuts too.",,,A+,mandatory,True,False,[],0,4
Carter,Rees,VGVhY2hlci0xOTcwODcx,Sociology,Brigham Young University,SOC383,2016-01-15 15:58:23 +0000 UTC,UmF0aW5nLTI1OTQ3ODM0,4,3,5,,4,"Took it as an elective, topic interesting, he is entertaining. Fun class, learned a lot, would take again.",,,B+,,True,False,[],0,4
Carter,Rees,VGVhY2hlci0xOTcwODcx,Sociology,Brigham Young University,SOC383,2015-12-31 16:12:20 +0000 UTC,UmF0aW5nLTI1ODU0NTEy,5,2,5,,4,Awesome Teacher!,,,,mandatory,True,False,[],1,4
Carter,Rees,VGVhY2hlci0xOTcwODcx,Sociology,Brigham Young University,SOC383,2015-12-09 08:52:28 +0000 UTC,UmF0aW5nLTI1NjAzMjEz,4,2,4,,4,Rees is a convert so he has a lot to offer on topics relating to delinquency. He offers different perspectives and makes you question the way you think without telling you you&#39;re wrong if you don&#39;t think the way he does. He&#39;s hilarious and is a very reasonable man when it comes to grades/assignments. Get to know him cause he&#39;s awesome!!,,,A,non mandatory,True,False,[],0,7
Carter,Rees,VGVhY2hlci0xOTcwODcx,Sociology,Brigham Young University,SOC383,2015-12-05 00:04:00 +0000 UTC,UmF0aW5nLTI1NTU0MTk1,3,3,3,,5,"I liked the class, but I wish we&#39;d written a paper or something - considering the material (especially since he really does love it and makes us interested in it). We had four tests and they were all multiple choice or fill in the tabs out of 30, so if you didn&#39;t get them all right - then you were already down to a A-.",,,Rather not say,mandatory,True,False,[],8,1
Carter,Rees,VGVhY2hlci0xOTcwODcx,Sociology,Brigham Young University,383,2015-05-05 00:54:14 +0000 UTC,UmF0aW5nLTI0NzM5OTc2,4,3,5,,4,Very engaging personality. Topic is interesting. Open to all ideas but keeps the class respectful to each others opinion. ,,,B,non mandatory,True,False,[],0,7
Carter,Rees,VGVhY2hlci0xOTcwODcx,Sociology,Brigham Young University,383,2015-04-25 20:39:14 +0000 UTC,UmF0aW5nLTI0NjY5Njgz,4,3,4,,4,"Fun professor. Likes discussion and student participation. Makes you think about what you value and introduces you to new ideas without jamming them down your throat as &#34;right&#34;. Would take again, learned a lot.",,,B+,non mandatory,True,False,[],0,5
Carter,Rees,VGVhY2hlci0xOTcwODcx,Sociology,Brigham Young University,SOC383,2015-03-25 23:48:50 +0000 UTC,UmF0aW5nLTI0NTA0MDE0,4,2,4,,4,"Great lectures, great personality, always there to help.",,,,,True,False,[],0,7
Bronson,Argyle,VGVhY2hlci0xOTcxMzUx,Business,Brigham Young University,FIN453,2017-12-13 01:49:27 +0000 UTC,UmF0aW5nLTI5MTY5MDEw,5,4,5,1.0,5,"Easily one of the best teachers I&#39;ve ever had! Loved his class! My favorite out of the 3 (401, 410, &amp; 453). Not an easy course by any means, you have to work for it, but it teaches you to be financially literate and Argyle is the best. Tests can be tricky, avg. was usually around 80. Easy quiz each week. Group homework assignment each week also",Respected--Would take again,,,mandatory,True,False,[],0,0
Vincent,Wilding,VGVhY2hlci0xOTcxNjcw,Chemical Engineering,Brigham Young University,CHEN311,2015-11-20 15:44:03 +0000 UTC,UmF0aW5nLTI1NDYyNTgy,3,2,4,,2,"Dr. Wilding is a great professor, but 311 is a cornucopia of random safety and environmental facts. Sometimes it&#39;s hard to know what&#39;s on the test. ",,,A+,,True,False,[],0,0
Vincent,Wilding,VGVhY2hlci0xOTcxNjcw,Chemical Engineering,Brigham Young University,CHEN311,2015-01-03 20:27:21 +0000 UTC,UmF0aW5nLTI0MjIyMzM2,5,2,5,,2,"Dr. Wilding has been my favorite teacher at BYU. He teaches super clearly and tests based on what you&#39;ve been taught. He is absolutely fair about everything he does and does an excellent job of organizing an engineering class. He is a totally quality teacher, and I wish I could take more classes from him.",,,,,True,False,[],0,0
Vincent,Wilding,VGVhY2hlci0xOTcxNjcw,Chemical Engineering,Brigham Young University,CHEN311,2014-12-31 18:59:44 +0000 UTC,UmF0aW5nLTI0MjExMTMw,5,3,5,,3,"ChEn 311 was one of the most eye-opening classes I took at BYU. It gave me more work than I thought it should, but I also learned a lot. Dr. Wilding is such a good guy and definitely there to help you. He inspires you to be a great engineer.",,,,,True,False,[],0,0
Danielle,Murray,VGVhY2hlci0xOTcxNzU0,Dance,Brigham Young University,DANCE171,2016-11-04 10:48:48 +0000 UTC,UmF0aW5nLTI3MTI5Mzky,5,2,5,1.0,0,I love Danielle! I loved taking her class because she made an effort to have a relationship with her students. I have never clogged before but she was always very helpful about giving tips on how to improve. She is very good dancer so its great to learn from someone with that ability. She gives plenty of time to master Choreography.,Gives good feedback--Skip class? You won't pass.--Caring,,,mandatory,True,False,[],0,0
