firstName,lastName,teacherId,department,schoolName,class,date,reviewId,clarityRating,difficultyRating,helpfulRating,wouldTakeAgain,textbookUse,comment,ratingTags,teacherNote,grade,attendanceMandatory,isForCredit,isForOnlineClass,thumbs,thumbsDownTotal,thumbsUpTotal
David,Amott,VGVhY2hlci0xOTMyMzM4,Art,Brigham Young University,ARTH201,2015-04-21 20:43:33 +0000 UTC,UmF0aW5nLTI0NjQxMDUx,5,3,5,,5,"Dr. Amott is one of my favorite professors thus far at BYU. As someone who is well into a science major, it was really refreshing to get some culture. The principals of analyzing art Amott teaches will overlap in other areas of you life, and it makes the world a more interesting place. The class was not too challenging, pop quizzes can hurt though.",,,A,,True,False,[],0,0
David,Amott,VGVhY2hlci0xOTMyMzM4,Art,Brigham Young University,201,2015-01-21 11:44:15 +0000 UTC,UmF0aW5nLTI0MzE0OTU2,5,3,5,,5,David Amott was by far the most caring professor I have had at BYU. I am far from an Art History major and I can honestly say it is one thing I am not passionate about. All I really ask for in a professor is that they be passionate about what they are teaching and that they genuinely care about their students. David rocks both of those qualities!,,,,,True,False,[],0,0
David,Amott,VGVhY2hlci0xOTMyMzM4,Art,Brigham Young University,ARTH202,2014-12-20 12:49:33 +0000 UTC,UmF0aW5nLTI0MTU0NjQy,3,2,4,,2,"Professor Amott is very passionate about art history, to the level that it is hilarious. I have signed up for and attended many art history classes before and I always dropped them because the professors were ridiculously tough and boring. Amott is entertaining and, honestly, it does not take much to get a good grade. Show up for attendance quizzes",,,A,,True,False,[],0,0
David,Amott,VGVhY2hlci0xOTMyMzM4,Art,Brigham Young University,ARTHC202,2014-12-03 20:29:26 +0000 UTC,UmF0aW5nLTIzOTM5OTA4,4,3,4,,3,"I did pass out in class a couple times but because Professor Amott is a very passionate teacher, it&#39;s not a common occurrence. Reviews with TA are essential for  acing tests. The tests aren&#39;t hard, just do what the TA&#39;s say.  Participation is necessary. Show up to class and skim the book and you&#39;ll do fine. Overall, helped me enjoy art.",,,A-,mandatory,True,False,[],0,0
David,Amott,VGVhY2hlci0xOTMyMzM4,Art,Brigham Young University,ARTHC,2014-11-04 21:57:45 +0000 UTC,UmF0aW5nLTIzNzQ0NjA5,3,4,4,,3,"I wish I could take all of my classes from Dr Amott.  He is engaging, entertaining and hilarious.  Unfortunately, apart from him, this class is like weeding a cactus garden; an extremely slow and painful process, where even after you are done, you still have to pick out all of the tiny needles that are still in your hands for a long time afterward.",,,,mandatory,True,False,[],0,2
David,Amott,VGVhY2hlci0xOTMyMzM4,Art,Brigham Young University,ARTHC202,2014-10-29 18:16:45 +0000 UTC,UmF0aW5nLTIzNzEyOTg5,4,4,4,,3,"Professor Amott takes an inherently boring subject in Art History and makes it come to life with unrivaled enthusiasm and humor.  The class covers a wide span of subject matter and rewards detailed note-taking and the completion of reading assignments.  Kind of a tough class in general, but worth it: it double-counts, completing two GE credits.",,,,,True,False,[],0,0
Jennifer,Wimmer,VGVhY2hlci0xOTMzMjQz,Elementary Education,Brigham Young University,ELED333,2020-02-21 18:43:29 +0000 UTC,UmF0aW5nLTMyOTI0NjY5,5,3,5,1.0,5,"I. Love. Dr. Wimmer. Do anything you can to take a class from her or your experience at BYU will not be complete. She knows her stuff well and will teach you amazing things. She is accessible outside of class (GO TALK WITH HER, it will change your life...+snacks!) and wants the best for you. Put effort into her class and assignments--it is worth it",Accessible outside class--Hilarious--Amazing lectures,,A,,True,False,[],0,0
Jennifer,Wimmer,VGVhY2hlci0xOTMzMjQz,Elementary Education,Brigham Young University,ELED333,2019-12-18 18:19:12 +0000 UTC,UmF0aW5nLTMyNzA2Nzk0,5,4,5,1.0,5,"Dr. Wimmer is AMAZING! She genuinely cares about your success! Talk to her about anything and she will do her best to help you. The class is not bad. There are several papers, but you know in advance. She makes it very doable. Keep up on everything and you will be very successful. You will be enriched academically and spiritually. Take from her!!!",Gives good feedback--Respected--Accessible outside class,,,,True,False,[],0,0
Alonzo,Cook,VGVhY2hlci0xOTMzMzA0,Chemical Engineering,Brigham Young University,CHEN191,2018-12-23 03:00:09 +0000 UTC,UmF0aW5nLTMxMTQyMzQx,5,1,5,1.0,0,Pass/ fail Participation - Reading questions - Attend most lectures The information in this class is awesome. I love that I can just learn instead of stressing about grades.,Skip class? You won't pass.--Caring--LECTURE HEAVY,,,mandatory,True,False,[],0,0
Alonzo,Cook,VGVhY2hlci0xOTMzMzA0,Chemical Engineering,Brigham Young University,CHEME378,2017-12-13 15:37:49 +0000 UTC,UmF0aW5nLTI5MTc4NzQx,3,3,3,0.0,5,"I didn&#39;t feel like the homework assignments prepared me well for the test, which was very much conceptual. Dr. Cook didn&#39;t really respect my ideas and concerns. He does answer your questions, but I left more confused after he &#34;answered&#34; them. If this were an optional class, I would not take it. Overall, an &#34;I could care less&#34; class.",Get ready to read,,B+,non mandatory,True,False,[],2,0
Alonzo,Cook,VGVhY2hlci0xOTMzMzA0,Chemical Engineering,Brigham Young University,CHEN378,2017-12-12 00:08:57 +0000 UTC,UmF0aW5nLTI5MTQ0Mzk1,4,3,4,1.0,5,"Dr. Cook is sensible and helpful. He does a good job teaching challenging material and makes sure to take the time to help everyone understand. His tests are hard, but he lets you use a page of notes. Daily reading quizzes and homework assignments always end up taking more time than you&#39;d expect, so don&#39;t put them off til the last minute.",LOTS OF HOMEWORK--Caring--Tests are tough,,A,non mandatory,True,False,[],0,0
Alonzo,Cook,VGVhY2hlci0xOTMzMzA0,Chemical Engineering,Brigham Young University,CHEN378,2015-12-16 20:50:22 +0000 UTC,UmF0aW5nLTI1NzMyNzU1,3,3,4,,4,"Sometimes we would get behind in class so we would end up having to rush material and it wouldn&#39;t make sense, but Dr. Cook is one of the most reasonable ChEn teachers at BYU. Really great guy, knows his stuff, and very willing to help you. He&#39;s also good about giving points back on tests.",,,A,non mandatory,True,False,[],0,0
Alonzo,Cook,VGVhY2hlci0xOTMzMzA0,Chemical Engineering,Brigham Young University,378,2014-10-31 13:27:58 +0000 UTC,UmF0aW5nLTIzNzIyNTM4,4,4,3,,1,One of the better ChemE professors and his MatSci course has been my favorite ChemE class yet! (Of course the competition isn&#39;t high) Great teacher though his research is incredible!,,,A-,mandatory,True,False,[],0,2
Jeffrey,Carter,VGVhY2hlci0xOTMzNTU3,Religion,Brigham Young University,FDREL250,2018-03-18 23:13:47 +0000 UTC,UmF0aW5nLTI5NjY2MDIx,3,3,3,0.0,5,"I took this class, hoping to strengthen my testimony of Christ, and instead ended up focusing more on tedious details so that I wouldn&#39;t lose points on assignments. I&#39;ve never had a teacher be so specific about the content of my posts before. Be very careful with reading instructions. He likes to try and trick you.",Tough Grader--Get ready to read--Caring,,A-,mandatory,True,True,[],0,2
Jeffrey,Carter,VGVhY2hlci0xOTMzNTU3,Religion,Brigham Young University,REL121,2016-05-18 16:45:29 +0000 UTC,UmF0aW5nLTI2NjA5NzM4,2,4,4,,0,"Brother Carter is really helpful if you are diligent about going in and asking for help. His tests were online and on the honor code. They are pretty tricky though and he focuses on specific quotes and will switch small words. It&#39;s a seminary class. If you want a deeper understanding of the Book of Mormon or an easy A, don&#39;t take from  Carter.",,,A,mandatory,True,False,[],0,0
Jeffrey,Carter,VGVhY2hlci0xOTMzNTU3,Religion,Brigham Young University,RELA122,2016-04-29 16:25:54 +0000 UTC,UmF0aW5nLTI2NDE3NzAy,5,1,5,,5,"Brother Carter was one of the greatest professors I&#39;ve ever had. He cares more about your personal development and understanding of gospel topics than making this a difficult, college-level religion course. As long as you attend class, do the readings, and honestly pay attention, you&#39;ll be fine",,,A,mandatory,True,False,[],0,0
Jeffrey,Carter,VGVhY2hlci0xOTMzNTU3,Religion,Brigham Young University,RELA121,2016-04-18 13:02:07 +0000 UTC,UmF0aW5nLTI2MzE4MzY4,4,2,5,,1,Professor Carter is a great teacher! He makes lectures interesting and enjoyable. The class if very easy if you show up to class and study the powerpoints a little bit before the quizzes. The only thing I didn&#39;t like was you have to make sure to read the quiz questions very well because some of them or designed to trick you. I definitely recommend!,,,Not sure yet,mandatory,True,False,[],0,0
Jeffrey,Carter,VGVhY2hlci0xOTMzNTU3,Religion,Brigham Young University,REL121,2016-04-15 22:37:05 +0000 UTC,UmF0aW5nLTI2MzA4MDIw,2,4,3,,3,Has a lot of weird questions about specific quotes and things he personally thinks are important. Very fun and friendly and a great guy but seems like he tries to find ways to complicate the class.,,,,mandatory,True,False,[],0,0
Jeffrey,Carter,VGVhY2hlci0xOTMzNTU3,Religion,Brigham Young University,RELA121,2016-04-15 14:27:04 +0000 UTC,UmF0aW5nLTI2MzA1NDg3,3,4,3,,4,"He loves true false questions and will change one or two of the important words to get you. Loves &#34;gotcha&#34; questions.  He focuses on doctrine of the church and supplemental readings more than on the actual Book of Mormon. It&#39;s a seminary class. If you want a deeper understanding of the Book of Mormon or an easy A, don&#39;t take from Brother Carter.",,,A-,non mandatory,True,False,[],0,0
Jeffrey,Carter,VGVhY2hlci0xOTMzNTU3,Religion,Brigham Young University,REL121,2016-04-09 19:28:01 +0000 UTC,UmF0aW5nLTI2MjYyMjM5,5,2,4,,4,"If you liked seminary, Bro Carter is for you. Take careful notes in class because he doesn&#39;t post the important information from the slideshow online, and the quizzes are almost exactly like the slideshows from class. If you space on a quiz or other assignment, he&#39;ll let you do it late most of the time.",,,,mandatory,True,False,[],0,0
Jeffrey,Carter,VGVhY2hlci0xOTMzNTU3,Religion,Brigham Young University,REL121,2016-04-07 19:45:20 +0000 UTC,UmF0aW5nLTI2MjUyOTIy,2,4,2,,4,"Really good guy, but good luck getting help if you need it. Wouldn&#39;t even talk to me before the midterm, probably going to fail, but the glorified seminary teacher in him won&#39;t help me at all.",,,C,mandatory,True,False,[],0,0
Jeffrey,Carter,VGVhY2hlci0xOTMzNTU3,Religion,Brigham Young University,REL121,2016-04-07 15:22:37 +0000 UTC,UmF0aW5nLTI2MjUwOTEx,4,2,4,,4,"Fantastic teacher, who creates a very spiritual atmosphere every class. Many of his quiz and test questions are taken almost word-for-word of things he says in class,  so pay close attention and you&#39;ll do well.",,,A,mandatory,True,False,[],0,0
Jeffrey,Carter,VGVhY2hlci0xOTMzNTU3,Religion,Brigham Young University,RELA121,2016-04-06 16:36:04 +0000 UTC,UmF0aW5nLTI2MjQzMzk2,5,3,4,,5,All his tests and quizzes are online but closed note and book.  This means theyre tough unless you study an hour for them beforehand (he provides PowerPoints and stuff).  If you want an A you definitely need to attend class and pay attention because some quiz and test questions will just be from his lectures.   You can feel the spirit in class.,,,A,mandatory,True,False,[],0,0
Jeffrey,Carter,VGVhY2hlci0xOTMzNTU3,Religion,Brigham Young University,REL121,2016-04-06 02:33:11 +0000 UTC,UmF0aW5nLTI2MjM5NDE0,4,1,4,,1,"Bro. Carter is a really great teacher! I loved him; took two semesters with him and it was worth it. You always feel the spirit in lectures and he is always open to questions. He does give you three free absences but I suggest showing up to class anyway, he&#39;s that good!",,,B+,non mandatory,True,False,[],0,0
Jeffrey,Carter,VGVhY2hlci0xOTMzNTU3,Religion,Brigham Young University,RELA121,2016-04-05 04:10:25 +0000 UTC,UmF0aW5nLTI2MjMxODk0,5,3,4,,5,"Brother Carter is great and really funny. I liked him so much that I&#39;m taking another class from him next semester. His quizzes are very difficult because they are so specific on small details, however they are almost always word for word from the powerpoints",,,A,mandatory,True,False,[],0,0
Jeffrey,Carter,VGVhY2hlci0xOTMzNTU3,Religion,Brigham Young University,RELA121,2015-11-19 11:30:51 +0000 UTC,UmF0aW5nLTI1NDUwNjcw,3,4,3,,4,"Brother Carter nice and funny and cares about his students and the gospel a lot. That being said, i probably wouldn&#39;t take a class from him again. In lecture he often asks questions that are supposedly open ended but he is only looking for one specific answer which personally drives me CRAZY! His quizes are hard and very specific to being in class",,,,mandatory,True,False,[],1,0
Jeffrey,Carter,VGVhY2hlci0xOTMzNTU3,Religion,Brigham Young University,RELA121,2015-11-04 02:31:38 +0000 UTC,UmF0aW5nLTI1MzM4NzUw,5,2,5,,1,"Brother Carter really cares about his students. He wants everyone to grow closer to Christ, and therefore, increases the amount of attention needed. If you pay attention and take notes, you&#39;ll do well. And no, he doesn&#39;t give pop quizzes like the person below said, he gives weekly quizzes with fair warning on Learning Suite",,,A,,True,False,[],0,0
Jeffrey,Carter,VGVhY2hlci0xOTMzNTU3,Religion,Brigham Young University,RELA121,2015-11-04 02:26:12 +0000 UTC,UmF0aW5nLTI1MzM4NzI4,2,4,3,,1,"Brother Karter is a great guy, but he rushes through lectures and gets off topic pretty easily.  His quizzes are tough and you literally have to listen to specific words he says or you will fail, and also the tests and quizzes are based on his opinions, not on actual doctrine.  He&#39;s great but I probably wouldn&#39;t take again. ",,,,mandatory,True,False,[],0,0
Jeffrey,Carter,VGVhY2hlci0xOTMzNTU3,Religion,Brigham Young University,REL121,2015-11-03 23:01:17 +0000 UTC,UmF0aW5nLTI1MzM3NTEy,5,2,5,,4,"Bro Carter is the Man! I enjoyed his class so much. He&#39;s caring and really loves each of his students. I have become so much closer to Christ and learned so much that I didn&#39;t think I could. But yes, Amazing! Take him!",,,B+,mandatory,True,False,[],0,0
Jeffrey,Carter,VGVhY2hlci0xOTMzNTU3,Religion,Brigham Young University,RELA211,2015-11-02 02:26:17 +0000 UTC,UmF0aW5nLTI1MzIyNTkw,5,2,4,,3,Professor Carter was great.  I actually felt the spirit in this religion class.  Pay attention during lecture as many things that are talked about in lecture come up in the weekly quizzes and tests.  I got an A and it wasnt that hard to get it,,,A,non mandatory,True,False,[],0,0
Jeffrey,Carter,VGVhY2hlci0xOTMzNTU3,Religion,Brigham Young University,RELA211,2015-08-23 17:58:56 +0000 UTC,UmF0aW5nLTI1MTQ0MDI0,5,1,4,,4,"Bro. Carter is an inspiring professor.  If you take decent notes and study them before you take each quiz you&#39;ll easily get an A.  Everything was done using LearningSuite. Almost all midterm and final questions come from these weekly quizzes, so studying for those is cake.  Weekly reflection assignments are simple.  Overall this was a great class.",,,A,mandatory,True,False,[],0,0
Jeffrey,Carter,VGVhY2hlci0xOTMzNTU3,Religion,Brigham Young University,RELA211,2015-08-19 12:26:31 +0000 UTC,UmF0aW5nLTI1MTMzNjY2,2,3,4,,5,"Bro Carter is a great guy who really wants to bring his students closer to Christ. His weekly quizzes were usually pretty tough, and you have to pay very close attention to his lectures, he often rushes through a topicscripture that ends up on the quizzes. There were weekly and end-of-term writing assignments as well, but he&#39;s easy on grading them",,,,mandatory,True,False,[],1,0
Jeffrey,Carter,VGVhY2hlci0xOTMzNTU3,Religion,Brigham Young University,RELA211,2015-08-19 09:24:56 +0000 UTC,UmF0aW5nLTI1MTMzMTc5,2,3,3,,5,This was not my favorite class. The quizzes are more about New Testament class than the New Testament (questions such as &#34;Which points were on this slide in Tuesday&#39;s lecture?&#34; or &#34;What was the focus of our discussion Monday about this?&#34;). I feel like that inhibited learning on the topic as more focused was placed on the minutia than on the gospel.,,,,,True,False,[],2,1
Jeffrey,Carter,VGVhY2hlci0xOTMzNTU3,Religion,Brigham Young University,REL211,2015-08-11 10:36:54 +0000 UTC,UmF0aW5nLTI1MTEwNTU1,3,3,4,,4,"Interesting teacher, Made new testament interesting at least. Quizzes were a pain because of little details from the readings or comments in class that you need to remember but he was spiritual yet funny. Not a bad teacher.",,,B,mandatory,True,False,[],0,0
Jeffrey,Carter,VGVhY2hlci0xOTMzNTU3,Religion,Brigham Young University,RELA121,2015-04-02 14:32:21 +0000 UTC,UmF0aW5nLTI0NTM2OTkw,2,4,3,,4,"His pop quizzes are really hard and tricky. You really, really have to read everything extremely close and listen to all of his little nuances in lecture or you won&#39;t pass the quizzes or midterms. Less about what the scriptures mean and more about little   wordplays and whatnot. ",,,B,mandatory,True,False,[],0,0
Jeffrey,Carter,VGVhY2hlci0xOTMzNTU3,Religion,Brigham Young University,RELA122,2014-12-31 20:43:06 +0000 UTC,UmF0aW5nLTI0MjExMzU0,4,1,4,,3,"Bro. Carter&#39;s lectures are very inspirational! This is the first religion class where I actually felt like my testimony grew. Test questions come from quizzes, so be sure to go to class everyday. ",,,,mandatory,True,False,[],1,0
Jeffrey,Carter,VGVhY2hlci0xOTMzNTU3,Religion,Brigham Young University,RELA121,2014-12-10 22:44:22 +0000 UTC,UmF0aW5nLTI0MDI3Mjg0,4,2,5,,5,"Carter was super insightful and understanding. He knew his students pretty well, and it seemed like everyone in the class was interested and participated in his lessons. There were weekly quizzes on the reading, and sometimes they were tricky. He drops a couple, and that helps a lot. Tests are not bad-he draws from the weekly quizzes. Good class!",,,,mandatory,True,False,[],0,0
Jeffrey,Carter,VGVhY2hlci0xOTMzNTU3,Religion,Brigham Young University,RELA122,2014-11-04 20:38:41 +0000 UTC,UmF0aW5nLTIzNzQzOTc5,3,2,4,,3,"Brother Carter was a very spiritual teacher and the tests were easy. However, lectures were often pretty dull. You have to go to almost every single class, you only get 3 absences a semester. There are quizzes every week IN CLASS, and he tends to ask trick questions-- on purpose. Plus, he never tells you what day the quiz will be.",,,A,mandatory,True,False,[],0,3
Jeffrey,Carter,VGVhY2hlci0xOTMzNTU3,Religion,Brigham Young University,REL121,2014-11-03 16:14:43 +0000 UTC,UmF0aW5nLTIzNzMzNDcw,5,1,5,,1,his religion class was super insightful. he focuses on spiritual and factual factors. the workload is super light and the discussions in class are always really great ,,,A+,mandatory,True,False,[],8,0
Karen,Auman,VGVhY2hlci0xOTM0Mzcz,History,Brigham Young University,HIST217,2019-12-19 20:29:27 +0000 UTC,UmF0aW5nLTMyNzIxNjY2,2,4,2,0.0,5,"Dr Auman is super caring, and a very good person. However, her class required a MINIMUM 30 hour project (it took me 40 hours) and a ton of time outside of class. Her lectures are boring. Theres no midterm, so I didnt know how the final was formatted. If you take this class, be ready to put in a lot of time, and study a lot before the final.",Participation matters--So many papers--Graded by few things,,,Y,True,False,[],0,0
Karen,Auman,VGVhY2hlci0xOTM0Mzcz,History,Brigham Young University,HIST217,2019-04-18 00:05:27 +0000 UTC,UmF0aW5nLTMxNjE3Nzky,3,3,3,1.0,5,"Her assignments were fair and reasonable. I also like how she believes in donating her time to do genealogy for others As a note, Professor Auman is slightly passive aggressive. It seems to me that there are times when she acts happy but is actually quite irked. She also won&#39;t continue talking until there aren&#39;t any distractions going on in class.",Respected--Accessible outside class--Clear grading criteria,,Not sure yet,non mandatory,True,False,[],0,0
Karen,Auman,VGVhY2hlci0xOTM0Mzcz,History,Brigham Young University,HIST217,2016-12-06 19:52:59 +0000 UTC,UmF0aW5nLTI3MzU3NzIz,5,4,5,1.0,0,"Professor Auman is a great professor. She explains things nicely and is very helpful. For this class, you will have a 50 hour research project and be required to write several papers, but none of them are too difficult. She is extremely helpful and gives you plenty of time. I would highly recommend her!",ACCESSIBLE OUTSIDE CLASS--SO MANY PAPERS--Amazing lectures,,,mandatory,True,False,[],0,2
Karen,Auman,VGVhY2hlci0xOTM0Mzcz,History,Brigham Young University,HIST220,2015-11-16 21:54:27 +0000 UTC,UmF0aW5nLTI1NDI2MjEy,1,5,2,,5,"Karen Auman&#39;s class is focused on writing/english, not necessarily history. All assignments and exams are written papers. If you don&#39;t know how to write, this class is not for you. Some things she says are false or not strongly supported but she stands by them as if they were facts.",,,Not sure yet,mandatory,True,False,[],0,1
Karen,Auman,VGVhY2hlci0xOTM0Mzcz,History,Brigham Young University,HIST220,2015-09-30 19:40:00 +0000 UTC,UmF0aW5nLTI1MjE5NDQy,3,4,3,,4,It was almost all based on readings. gives pop quizzes in class on occasion based on reading assignments. Memorize the book to get an A.,,,A,mandatory,True,False,[],0,2
Karen,Auman,VGVhY2hlci0xOTM0Mzcz,History,Brigham Young University,HIST220,2015-01-02 12:02:11 +0000 UTC,UmF0aW5nLTI0MjE1OTM4,4,3,4,,2,"Professor Auman was an adequate teacher.  Her expectations were fairly clear and there were not too many assignments.  She did explain the material.  However, her lectures were not very interesting and she taught a cookie-cutter version of history.  She never really challenged my perspectives and wasn&#39;t very open minded.",,,,,True,False,[],0,3
Karen,Auman,VGVhY2hlci0xOTM0Mzcz,History,Brigham Young University,HIST220,2015-01-02 11:58:49 +0000 UTC,UmF0aW5nLTI0MjE1OTIy,4,3,4,,2,"Professor Auman was an adequate teacher.  Her expectations were fairly clear and there were not too many assignments.  She did explain the material.  However, her lectures were not very interesting and she taught a cookie-cutter version of history.  She never really challenged my perspectives or shed new light on the subject matter. ",,,,,True,False,[],0,1
Karen,Auman,VGVhY2hlci0xOTM0Mzcz,History,Brigham Young University,HIST220,2014-11-18 02:09:49 +0000 UTC,UmF0aW5nLTIzODM2OTgy,4,3,4,,5,"Pr Auman makes US History soooo interesting! I thought I would hate this class but it ended up being one of my favorites! Her lectures are very clear and she is always ready to answer questions. Sometimes the readings can be long, but always very interesting and carefully chosen. If you take good notes and do the readings, you should do fine.",,,,mandatory,True,False,[],1,1
Samuel,Richards,VGVhY2hlci0xOTM0NjUy,Music,Brigham Young University,MUSIC296,2015-04-02 12:43:02 +0000 UTC,UmF0aW5nLTI0NTM2Mzgx,3,2,5,,1,"Dr. Richards is a musical genius. I love his class because you&#39;re excited to be there. No tough homework, 1 some-what hard mid-term. He helps you become excited about what he&#39;s talking about. I&#39;d definitely take another class from him. ",,,,,True,False,[],0,1
Samuel,Richards,VGVhY2hlci0xOTM0NjUy,Music,Brigham Young University,MUSIC195,2014-12-31 05:00:06 +0000 UTC,UmF0aW5nLTI0MjA5Mjg0,3,1,5,,1,"Take a class from Dr. Richards. It&#39;s an incredible experience. He approaches things unconventionally, more open minded and participation-based than most classes. Class is personal, casual, and a genuinely fun experience. If you like rigidly structured classes, it&#39;s not for you, but it is if you like to learn from a personal &amp; meaningful standpoint.",,,,,True,False,[],0,2
Rachel,Gilman,VGVhY2hlci0xOTM1MTAz,Writing,Brigham Young University,WRITING150,2016-12-08 12:51:28 +0000 UTC,UmF0aW5nLTI3Mzg4NjE4,5,1,5,1.0,0,"Honestly, Rachel is the best.  She&#39;s super chill and is always willing to help out.  There&#39;s barely any homework and only 3 essays throughout the semester.  She gives you a rubric before each essay, and as long as you follow it, you&#39;ll easily get an A.",Gives good feedback--Clear grading criteria--Caring,,A,non mandatory,True,False,[],0,0
Rachel,Gilman,VGVhY2hlci0xOTM1MTAz,Writing,Brigham Young University,WRTG150,2016-05-03 22:43:05 +0000 UTC,UmF0aW5nLTI2NDU3ODM0,4,2,4,,0,"Rachel was a great teacher and I would totally recommend her. She is very relaxed, and grades fairly easy if you show that you put time and thought into your papers.",,,A,non mandatory,True,False,[],0,0
Rachel,Gilman,VGVhY2hlci0xOTM1MTAz,Writing,Brigham Young University,WRTG150,2016-04-05 13:13:21 +0000 UTC,UmF0aW5nLTI2MjMzNzA2,4,2,5,,3,"Great teacher, makes class more interesting. Only have to write 3 papers for all Writing 150 classes. Gives extra credit opportunities to go to the writing center before turning in papers. Replies to your emails and is helpful. Fair with grading and allows you to re-write your papers if you aren&#39;t happy with the grade. Defiantly would recommend!",,,A,mandatory,True,False,[],0,0
Rachel,Gilman,VGVhY2hlci0xOTM1MTAz,Writing,Brigham Young University,WRTG150,2014-11-04 02:55:29 +0000 UTC,UmF0aW5nLTIzNzM3ODQ2,4,3,5,,4,"Rachel was awesome!!  She&#39;s very intelligent and knows what she&#39;s talking about. However, she doesn&#39;t expect you to know everything.  She gives great feedback on papers and is always super helpful if something isn&#39;t clear. I would definitely take from her again!",,,,,True,False,[],0,0
