firstName,lastName,teacherId,department,schoolName,class,date,reviewId,clarityRating,difficultyRating,helpfulRating,wouldTakeAgain,textbookUse,comment,ratingTags,teacherNote,grade,attendanceMandatory,isForCredit,isForOnlineClass,thumbs,thumbsDownTotal,thumbsUpTotal
Randolph,Walker,VGVhY2hlci0yMjk5Mjkw,English,Hampton University,ENG102,2021-05-02 01:04:15 +0000 UTC,UmF0aW5nLTM0Njc4MDQw,5,4,5,1.0,0.0,"Professor Walker is a great instructor! His assignments are straight-to-the-point and there are no surprises. He prioritizes his students in office hours and wants to help everyone he can. His assignments arent too hard, but you will need to follow instructions. I would take another class of his if available!",Accessible outside class--Skip class? You won't pass.--Clear grading criteria,,,Y,True,False,[],0,0
Randolph,Walker,VGVhY2hlci0yMjk5Mjkw,English,Hampton University,ENG201,2020-08-14 21:09:17 +0000 UTC,UmF0aW5nLTMzNTg3MTI1,5,3,5,1.0,5.0,Hes honestly an amazing professor. He really does what he can in terms of helping students to truly learn the material. He teaches students to look beyond what they may see or to relearn what they any do. I really recommend this class. Take it if you can.,Gives good feedback--Respected--Accessible outside class,,B+,mandatory,True,False,[],0,0
Randolph,Walker,VGVhY2hlci0yMjk5Mjkw,English,Hampton University,ENG101,2017-11-13 11:10:39 +0000 UTC,UmF0aW5nLTI4ODgyNzYw,4,3,4,1.0,5.0,He is great! It is easy to keep up with his work because its never anything crazy. Pay close attention to what he says about his assignments and you will be fine. You only have three class skips before he drops your grade so make sure you never skip.,Tough Grader,,A+,mandatory,True,False,[],0,3
Jacques,Digbeu,VGVhY2hlci0xNTU3NzM4,Humanities,Hampton University,FRE101H1,2021-05-07 01:06:31 +0000 UTC,UmF0aW5nLTM0NzI4NjQ4,5,2,5,1.0,5.0,Hes a cool teacher. He definitely knows his material and makes sure that students know it as well. I enjoyed taking this class a lot this semester.,Get ready to read--Participation matters--Graded by few things,,A-,mandatory,True,True,[],0,0
Jacques,Digbeu,VGVhY2hlci0xNTU3NzM4,Humanities,Hampton University,HUM201,2019-12-13 20:40:25 +0000 UTC,UmF0aW5nLTMyNjQ4NzIw,2,4,2,0.0,5.0,"I hated this class with a passion. The tests are online and he doesn&#39;t tell us when they&#39;re due so it&#39;s possible to miss a few unless you&#39;re checking the website every day. His notes in class do not relate to the tests at all. He takes forever to respond to emails and you won&#39;t know your grade until the end of the semester, which is too late.",Get ready to read--Test heavy--Lecture heavy,,A,non mandatory,True,False,[],0,0
Jacques,Digbeu,VGVhY2hlci0xNTU3NzM4,Humanities,Hampton University,FRE101H1,2019-10-20 19:24:06 +0000 UTC,UmF0aW5nLTMyMzAwNjM5,1,5,1,0.0,5.0,"Wouldnt recommend this professor to my worst enemy, I have no idea how other students gave him positive reviews.",Lots of homework--Test heavy--Tough grader,,B,mandatory,True,False,[],0,0
Jacques,Digbeu,VGVhY2hlci0xNTU3NzM4,Humanities,Hampton University,FRE201,2019-02-28 05:24:44 +0000 UTC,UmF0aW5nLTMxMzkwNjQ3,5,2,5,1.0,5.0,"Dr. Digbeu is a phenomenal human being. His heart is so warm and filled with a passion to teach his native language of French, which is so dear to his heart. I consider him to be a mentor and an inspiration to say the least. I guarantee if you try, you will gain so much more from this class than a good grade - the knowledge and wisdom is endless.",Respected--Lecture heavy--Caring,,A+,mandatory,True,False,[],0,0
Jacques,Digbeu,VGVhY2hlci0xNTU3NzM4,Humanities,Hampton University,FRE201,2018-12-18 01:17:03 +0000 UTC,UmF0aW5nLTMxMDcyODIz,5,1,5,1.0,5.0,Pretty easy class! Make sure to show up and take notes to know what will be on any upcoming test. Textbook was used to do homework assignments. Tests were not hard. You definitely should pass with an A.,LECTURE HEAVY,,A+,mandatory,True,False,[],0,0
Jacques,Digbeu,VGVhY2hlci0xNTU3NzM4,Humanities,Hampton University,FRE101H1,2015-10-21 00:50:09 +0000 UTC,UmF0aW5nLTI1Mjc0MDcy,3,4,5,,5.0,"Dr. Digbeu is pretty easy if you study the notes and keep on top of the work due. He does have a tendency homework assigned however you should still do it.  *Disclaimer: People who&#39;s taken French before will be a no brainer for people who&#39;s first time taking French should expect putting time in for the class, because it&#39;s extremely fast paced",,,A,mandatory,True,False,[],0,0
Eleanor,Earl,VGVhY2hlci01NTE3NzY=,English,Hampton University,ENG330,2021-05-07 16:59:01 +0000 UTC,UmF0aW5nLTM0NzMzNjU1,3,1,3,1.0,0.0,"I did do well in this class however, I am upset that I did not truly know my grade until the very end of the semester. The Professor through the semester would cancel often and not give us back our work in time for us to edit. She is also very pushy.",Participation matters--Skip class? You won't pass.--Graded by few things,,Rather not say,mandatory,True,False,[],0,0
Eleanor,Earl,VGVhY2hlci01NTE3NzY=,English,Hampton University,FILM314,2016-11-04 16:51:02 +0000 UTC,UmF0aW5nLTI3MTMxNjIx,1,1,1,0.0,5.0,"professor needs time off from work, she has too many jobs elsewhere. She walks in class looking lost, where her teachings are not accurate.",,,B,,False,False,[],0,0
Eleanor,Earl,VGVhY2hlci01NTE3NzY=,English,Hampton University,FILM314,2010-06-04 13:09:41 +0000 UTC,UmF0aW5nLTE3MzAyODY1,5,2,5,,5.0,"Professor Earl is a business woman/creator who teaches. Treat her classes as if you are going to an internship. Be responsible, show her your initive and take advangate of the many resources she presents. I believe she is one of the best professors in the English department. Truly striving to set her students up for life after the degree.",,,,,False,False,[],0,0
Eleanor,Earl,VGVhY2hlci01NTE3NzY=,English,Hampton University,ENG101,2007-11-19 15:47:37 +0000 UTC,UmF0aW5nLTEzNjc4ODM0,3,3,4,,4.0,"She is a wonderful teacher. Enjoyed every minute. Very sweet, patient and willing to help a student. DO your h.w. and go to class everyday and you will do fine!",,,,,False,False,[],0,0
Eleanor,Earl,VGVhY2hlci01NTE3NzY=,English,Hampton University,ENG101,2006-02-09 21:09:18 +0000 UTC,UmF0aW5nLTExNDcxNjU0,2,2,3,,,I agree she was very moody. Assignments were pretty easy though. I cant tell the whole situation to support why she is moody (b/c it may be considered libelous) but she seems very lonely and emotionally unstable. I wouldnt take her again,,,,,False,False,[],0,0
Eleanor,Earl,VGVhY2hlci01NTE3NzY=,English,Hampton University,ENG102,2005-01-10 19:39:41 +0000 UTC,UmF0aW5nLTMxOTQ2Mzc=,4,3,4,,,"She is a good teacher!  Make sure you are on time, turn off your phone, and pay attention.  She hates to repeat herself.  Also, make sure you read over your papers before turning them in. Give her respect and she will give you respect back.  She can be understanding!  I would recommend her!!!!",,,,,False,False,[],1,0
Eleanor,Earl,VGVhY2hlci01NTE3NzY=,English,Hampton University,ENG102H,2005-01-10 15:39:59 +0000 UTC,UmF0aW5nLTMxOTI0NDU=,2,2,3,,,"She is generally a good teacher, but she is also VERY moody.  Watch out for that.  She can be really unclear about assignments sometimes so be sure that you understand what she wants.  Other than that, she&#39;s okay.  I would take her again.",,,,,False,False,[],0,0
Karima,Jeffreys,VGVhY2hlci0xMjMyNzMw,English,Hampton University,ENG102,2021-04-30 16:15:53 +0000 UTC,UmF0aW5nLTM0NjY4MTg4,1,5,1,0.0,0.0,"WHATEVER YOU DO, DO NOT TAKE HER CLASS! Jeffrey is extremely rude, self-absorbed, and does not respect her students. Constantly tells you to refer to the syllabus when you try to ask questions, but the syllabus is not helpful whatsoever. Refuses to explain things thoroughly. I wish I had more characters to explain how truly unprofessional she is.",Lots of homework--Skip class? You won't pass.--Tough grader,,A-,mandatory,True,True,[],0,1
Karima,Jeffreys,VGVhY2hlci0xMjMyNzMw,English,Hampton University,ENG102,2021-04-23 23:38:34 +0000 UTC,UmF0aW5nLTM0NjEyNDEz,1,5,1,0.0,0.0,"I say this in the most respectful way possible. Horrible teacher, 0/10 would not recommend. Shes disrespectful and rude. I would not wish her class on my worst enemy. Its that bad. I never signed up for this lady, I just somehow got stuck with her. Doesnt explain how an assignment should be done until after she gives you a F and its too late.",Lots of homework--Skip class? You won't pass.--Tough grader,,C-,mandatory,True,True,[],0,1
Karima,Jeffreys,VGVhY2hlci0xMjMyNzMw,English,Hampton University,ENG102,2021-04-23 23:33:01 +0000 UTC,UmF0aW5nLTM0NjEyMzg1,1,5,1,0.0,0.0,"DO NOT TAKE HER. very inconsiderate and sarcastic... she literally plays shows for half of the semester. She does not give thorough instructions or details on projects, powerpoints, group projects, jounals, etc. IF SHE IS YOUR LAST OPTION TAKE ENGLISH DURING THE SUMMER",Tough grader,,,Y,True,True,[],0,1
Karima,Jeffreys,VGVhY2hlci0xMjMyNzMw,English,Hampton University,ENG102,2021-04-21 14:03:59 +0000 UTC,UmF0aW5nLTM0NTg5Mjk0,1,5,1,0.0,0.0,"Do not ever take her in your life, even if she is the last option available. Do not do it to yourself. Very rude and sarcastic. Grades hard and does not explain the material thoroughly. Don&#39;t expect to pass this class with anything higher than a B. Will tell you constantly to &#34;check the syllabus&#34; even if it dont make sense. Save yourself the stress",Participation matters--Skip class? You won't pass.--Tough grader,,C,mandatory,True,True,[],0,1
Karima,Jeffreys,VGVhY2hlci0xMjMyNzMw,English,Hampton University,ENG202,2021-03-10 15:59:25 +0000 UTC,UmF0aW5nLTM0NDI1MDYw,1,5,1,0.0,0.0,"She doesnt give feedback pertaining to your essay, barely responds to emails as well. She always gives smart comments when a student asks her about the project we are doing especially when they need more clarification. I would not recommend her class at all.",Tough grader--Participation matters--Group projects,,,Y,True,True,[],0,1
Karima,Jeffreys,VGVhY2hlci0xMjMyNzMw,English,Hampton University,ENG102,2021-03-09 21:05:22 +0000 UTC,UmF0aW5nLTM0NDIyNzcz,1,5,1,0.0,5.0,"She is very confusing with her wording. Provides little feedback that does not help much, requires a lot of extra work that could be avoided. Grades harshly especially for Eng 102, I would not recommend taking her if you are not majoring or minoring in English. You will have journal entries almost everyday you have class with her.",Tough grader--So many papers--Participation matters,,,Y,True,True,[],0,1
Karima,Jeffreys,VGVhY2hlci0xMjMyNzMw,English,Hampton University,ENG101,2021-01-11 15:45:45 +0000 UTC,UmF0aW5nLTM0MjYyNDYy,1,5,1,0.0,0.0,Took this course in the fall semester from August 10th to November 20th. It was the hardest English class I had ever taken and she was very vague with feedback which didn&#39;t help. She lacked the ability to be concise with what she wanted from her students and that hurt us all in the end. Even when questions were asked she danced around the answer.,Skip class? You won't pass.--Lecture heavy--Tough grader,,C+,mandatory,True,True,[],0,2
Karima,Jeffreys,VGVhY2hlci0xMjMyNzMw,English,Hampton University,ENG101,2020-11-24 00:39:53 +0000 UTC,UmF0aW5nLTMzODc3OTA2,1,5,1,0.0,5.0,"Shes terrible. If I could give her zero stars , I would. Please dont do it to yourself. Take someone elses class.",Tough grader--Participation matters--Skip class? You won't pass.,,,Y,True,False,[],0,1
Karima,Jeffreys,VGVhY2hlci0xMjMyNzMw,English,Hampton University,ENG101,2020-11-21 08:17:49 +0000 UTC,UmF0aW5nLTMzODY0NTY1,1,4,1,0.0,0.0,"Ummm well I might have a C hopefully, but I wouldn&#39;t know because my grade is not in. Feels like she grades based on her mood and you wouldn&#39;t want to ask her questions on a bad day. Criteria of assignments are not clear and explain afterward like students should have known. You may think you are doing well but if you are not perfect DROP CLASS :)",Participation matters--Tough grader,,C-,mandatory,True,False,[],0,1
Karima,Jeffreys,VGVhY2hlci0xMjMyNzMw,English,Hampton University,ENG101,2020-11-12 14:43:08 +0000 UTC,UmF0aW5nLTMzODA1ODQ5,2,4,2,0.0,0.0,"Very confusing and unnecessarily wordy when asked questions, yet somehow never answers what you&#39;re asking. Feedback is sarcastic comments or &#34;check the syllabus.&#34; You&#39;ll barely know what&#39;s going on because she doesn&#39;t always tell when things are due, she expects you to check her syllabus 24/7 instead of simply telling the class what&#39;s coming up.",Lots of homework--So many papers--Tough grader,,C-,mandatory,True,True,[],0,0
Karima,Jeffreys,VGVhY2hlci0xMjMyNzMw,English,Hampton University,ENG101,2020-11-03 18:05:13 +0000 UTC,UmF0aW5nLTMzNzY0NTA3,2,4,2,0.0,0.0,She was often rude and would rush student responses or give sarcastic responses/feedback. She would often make life harder than it had to be.,Get ready to read--Skip class? You won't pass.--Tough grader,,B-,mandatory,True,True,[],0,0
Karima,Jeffreys,VGVhY2hlci0xMjMyNzMw,English,Hampton University,ENG101,2020-10-30 15:08:22 +0000 UTC,UmF0aW5nLTMzNzUxNzEy,3,4,3,0.0,0.0,"horrible at giving feedback for the papers, if you don&#39;t have friends in the class or syllabus you wont know when anything is due. Not a clear grading criteria.",Lots of homework--Get ready to read--Tough grader,,C+,mandatory,True,False,[],0,0
Karima,Jeffreys,VGVhY2hlci0xMjMyNzMw,English,Hampton University,ENG101,2020-10-13 18:25:45 +0000 UTC,UmF0aW5nLTMzNjk3ODM2,3,3,3,1.0,0.0,"doesn&#39;t give great feedback, and if you have her for the fifty minute class she is rushing a lot.",Get ready to read,,B-,mandatory,True,True,[],0,0
Karima,Jeffreys,VGVhY2hlci0xMjMyNzMw,English,Hampton University,ENG101,2020-10-01 14:30:30 +0000 UTC,UmF0aW5nLTMzNjcyNzAw,1,4,1,0.0,5.0,"Frankly, Professor Jeffreys overall isnt that bad. I just dont think she should be teaching ENG 101. She is very well-read and knows her stuff. Unfortunately, her grading is harsh, especially with regards to essays. She leaves no valid explanations for why you were give the certain grade. Shes sometimes sarcastic as well. Love her laugh though!",Group projects--Lecture heavy--Tough grader,,,mandatory,True,False,[],0,0
Karima,Jeffreys,VGVhY2hlci0xMjMyNzMw,English,Hampton University,ENG101,2019-11-15 15:47:10 +0000 UTC,UmF0aW5nLTMyNDIxMDc2,3,4,3,0.0,5.0,Knows her material well. Harsh grader. Engaging. Sarcastic. Provoking. Not highly recommended.,Participation matters--Tough grader,,B,mandatory,True,False,[],0,0
Karima,Jeffreys,VGVhY2hlci0xMjMyNzMw,English,Hampton University,ENG101,2019-01-13 22:27:02 +0000 UTC,UmF0aW5nLTMxMjUyODA5,2,4,2,0.0,5.0,way too tough of a grader for a 101 class. I&#39;d feel different if she provided reliable feedback but she often answers questions vaguely &amp; sarcastically; Constantly saying &#34;it&#39;s on the syllabus&#34;. I don&#39;t think she&#39;s a bad person but she&#39;d be better off teaching a grad class instead of grading freshmen like grad students,Tough Grader--Skip class? You won't pass.--SO MANY PAPERS,,C-,mandatory,True,False,[],0,2
Karima,Jeffreys,VGVhY2hlci0xMjMyNzMw,English,Hampton University,ENG101,2018-06-03 13:52:24 +0000 UTC,UmF0aW5nLTMwMjI1NzAz,1,5,1,0.0,0.0,Run Forest Run! Do not take this professor!,,,Rather not say,mandatory,True,False,[],0,3
Karima,Jeffreys,VGVhY2hlci0xMjMyNzMw,English,Hampton University,ENG102,2018-04-19 04:15:00 +0000 UTC,UmF0aW5nLTI5ODM5ODg0,3,4,3,0.0,5.0,"Very rule, will interrupt your presentation without a care, knows material well, engaging class",,,,non mandatory,True,False,[],0,3
Karima,Jeffreys,VGVhY2hlci0xMjMyNzMw,English,Hampton University,ENG314,2018-04-04 13:41:59 +0000 UTC,UmF0aW5nLTI5NzQxMjA4,1,5,1,0.0,5.0,"Dr. Jeffrey is a terrible professor. If you can, avoid her at all costs. Some people aren&#39;t made to teach and she&#39;s one of them. I&#39;m not expecting more than a D+ in her class and I would have withdrawn if I had known that her course was this tough. She doesn&#39;t give clear feedback and her office hours are filled with ambiguity. Save yourself.",Tough Grader--BEWARE OF POP QUIZZES--LECTURE HEAVY,,D+,mandatory,True,False,[],0,5
Karima,Jeffreys,VGVhY2hlci0xMjMyNzMw,English,Hampton University,ENG102,2016-08-16 18:34:06 +0000 UTC,UmF0aW5nLTI2OTAwMjg5,1,5,1,0.0,5.0,Do not take this lady&#39;s class. She grades way too hard then doesn&#39;t explain or want to take the time to tell you  what you are doing right or wrong. Waited until a week after school was out to post grades to blackboard. I repeat do not take this lady&#39;s class,Tough Grader--Skip class? You won't pass.--LECTURE HEAVY,,C,mandatory,True,False,[],0,4
Karima,Jeffreys,VGVhY2hlci0xMjMyNzMw,English,Hampton University,ENG102,2016-05-06 17:35:43 +0000 UTC,UmF0aW5nLTI2NDkyNzAw,1,5,1,,5.0,She doesnt post assignments untill the end of the semester and doesnt give you feedback. dont take her if you want to graduate on time.,,,D+,mandatory,True,False,[],0,6
Karima,Jeffreys,VGVhY2hlci0xMjMyNzMw,English,Hampton University,ENG312,2016-05-06 13:50:40 +0000 UTC,UmF0aW5nLTI2NDkwNDM3,1,5,1,,0.0,I don&#39;t know why Hampton hired her tbh. She doesn&#39;t tell you how to study or what to study and on top of that she grades her essays harshly. Her lectures are based on her own interests &amp; her analyses are surface-level at best; she commits too much to herself or whatever and does not show interest in us. I wouldnt recommend her to my worst enemy.,,,B,mandatory,True,False,[],0,6
Karima,Jeffreys,VGVhY2hlci0xMjMyNzMw,English,Hampton University,ENG102,2016-01-07 22:56:06 +0000 UTC,UmF0aW5nLTI1OTAwMTcw,1,5,1,,2.0,Don&#39;t take her !,,,C,mandatory,True,False,[],0,5
Karima,Jeffreys,VGVhY2hlci0xMjMyNzMw,English,Hampton University,ENG101,2015-12-28 19:31:31 +0000 UTC,UmF0aW5nLTI1ODM5NDM4,1,4,1,,2.0,"It was extremely hard to get useful feedback from her. For an example,  I went to her for clarification on a paper, she said everything was fine, but when I got my poor grade back on the paper I was surprised. Also, she grades tough and the assignments that she assigns are not clear. I did not do too bad in this class, but it was really stressful.",,,B+,mandatory,True,False,[],0,6
Karima,Jeffreys,VGVhY2hlci0xMjMyNzMw,English,Hampton University,ENG101,2015-12-22 15:09:14 +0000 UTC,UmF0aW5nLTI1ODAzMTg5,1,4,1,,3.0,I think she is a pretty terrible teacher. She is not willing to clarify many questions and more often than not uses the phrase &#34;it&#39;s on the syllabus&#34;. Very stubborn and will not let you make up anything you may have done poorly on.,,,,mandatory,True,False,[],0,8
Karima,Jeffreys,VGVhY2hlci0xMjMyNzMw,English,Hampton University,101,2015-01-11 14:09:50 +0000 UTC,UmF0aW5nLTI0MjY3NDA2,1,4,1,,3.0,Worst English teacher in the department. Very unclear about assignments and is ridiculously picky when grading. ,,,C-,mandatory,True,False,[],0,6
Karima,Jeffreys,VGVhY2hlci0xMjMyNzMw,English,Hampton University,ENG101,2014-07-15 05:36:52 +0000 UTC,UmF0aW5nLTIzNDQ2MjE1,5,2,5,,5.0,"Class was simple, not as much writing as I had expected, about 7 or so essays, always bring both books to class! had great debates in class",,,B+,Y,False,False,[],5,0
Karima,Jeffreys,VGVhY2hlci0xMjMyNzMw,English,Hampton University,ENG101,2009-10-31 11:45:28 +0000 UTC,UmF0aW5nLTE2Mjk0ODA0,2,5,2,,4.0,She is not clear with what she assigns for work.  She does not really teach she basically assigns something and then dismisses class.,,,,,False,False,[],1,5
Maisoun,Bani Hani,VGVhY2hlci0yNjcwMjA1,Biology,Hampton University,BIO311,2021-05-12 07:03:43 +0000 UTC,UmF0aW5nLTM0NzcyNjcw,5,3,5,1.0,0.0,Dr. Bani is the best. Stay focus in her lectures to get extra points,Gives good feedback--Respected--Inspirational,,A-,mandatory,True,False,[],0,0
Maisoun,Bani Hani,VGVhY2hlci0yNjcwMjA1,Biology,Hampton University,BIO311,2021-05-12 02:40:21 +0000 UTC,UmF0aW5nLTM0NzcwOTQ1,5,4,5,1.0,5.0,She is the best in explaining the materials. Challenging tests but she gives extra credit. Be active during her lectures to receive extra points.,Respected--Test heavy--EXTRA CREDIT,,B+,mandatory,True,False,[],0,0
Maisoun,Bani Hani,VGVhY2hlci0yNjcwMjA1,Biology,Hampton University,BIO311,2021-05-09 04:31:39 +0000 UTC,UmF0aW5nLTM0NzQ1MDIx,5,3,5,1.0,0.0,I learned a lot in this class and I liked the way dr Bani make things easy to understand. You still need to work hard for her class and prepare for pop up quizzes and questions,Gives good feedback--Participation matters--Beware of pop quizzes,,A,mandatory,True,False,[],0,0
Maisoun,Bani Hani,VGVhY2hlci0yNjcwMjA1,Biology,Hampton University,BIO311,2021-04-07 17:47:16 +0000 UTC,UmF0aW5nLTM0NTE3NzU2,1,5,1,0.0,0.0,"I am taking Dr. Bani Hani&#39;s Biotechnology Lab and I took her Cell Bio class last semester. She responds to emails days later (&amp; after business hours) making communication confusing and frustrating, has no respect or regard for students, is consistently rude, and gets angry when students are confused. She doesn&#39;t care if students fail. Don&#39;t do it!",Lecture heavy,,Not sure yet,mandatory,True,True,[],0,0
Maisoun,Bani Hani,VGVhY2hlci0yNjcwMjA1,Biology,Hampton University,BIO311,2021-03-05 15:40:11 +0000 UTC,UmF0aW5nLTM0NDExOTQ4,1,5,1,0.0,0.0,"She is a horrible teacher. She is rude to students, unorganized, and not clear on what she wants. She never responds back to emails or shows up for office hours. She gives no explanations for her grading. She will fail you and not give you constructive criticism on how to do better. I definitely won&#39;t be taking her again,",Beware of pop quizzes--Lecture heavy--Tough grader,,C-,mandatory,True,False,[],0,0
Maisoun,Bani Hani,VGVhY2hlci0yNjcwMjA1,Biology,Hampton University,BIO311,2021-02-09 18:19:19 +0000 UTC,UmF0aW5nLTM0MzUyMjYx,1,4,1,0.0,0.0,"Don&#39;t take her classes! She sets her students up to fail. She&#39;s disrespectful, has an attitude problem, doesn&#39;t answer emails, gives unpleasant grades without explanations, and she is absolutely unaccommodating to the point where various students had to report her. I would NEVER take her class again. One of the worst experiences so far.",Lots of homework--Beware of pop quizzes--Tough grader,,Not sure yet,mandatory,True,True,[],0,0
Sarita,McCoy Gregory,VGVhY2hlci0yNTcxNTg5,Political Science,Hampton University,POL101,2021-05-14 16:26:37 +0000 UTC,UmF0aW5nLTM0NzkzMTcz,1,3,1,0.0,0.0,She does not put any grades in Blackboard and does not respond to emails. At the end of the semester she decided to put my classes final grades straight on HU NET without putting any grades on Blackboard for us to make sure they were correct which was super sneaky. She was nice is class but so unprofessional when it came to getting business done.,,,,mandatory,True,False,[],0,0
Sarita,McCoy Gregory,VGVhY2hlci0yNTcxNTg5,Political Science,Hampton University,POL201,2021-05-07 19:40:24 +0000 UTC,UmF0aW5nLTM0NzM1MzE5,1,3,1,0.0,0.0,"Dr. Gregory is extremely inaccessible outside of class. The whole class was confused the entire semester. Students tried to email her about wrong grades, and she would NEVER answer. Waited until last minute to put in grades. She hid the grades so that no one would ask about their grades and posted the final grades on the last day of the semester.",,,,mandatory,True,True,[],0,0
Sarita,McCoy Gregory,VGVhY2hlci0yNTcxNTg5,Political Science,Hampton University,POL201,2021-05-03 01:22:02 +0000 UTC,UmF0aW5nLTM0NjgzNjIx,3,2,3,0.0,0.0,Professor Gregory is very inaccessible outside of class. She has not replied to any of my emails during the semester and is very unorganized. She often makes grading mistakes and waits forever to fix them or will forget about them. Put&#39;s questions on the quizzes/tests that we never went over. Very nice tho.,,,,mandatory,True,True,[],0,0
Sarita,McCoy Gregory,VGVhY2hlci0yNTcxNTg5,Political Science,Hampton University,POL201,2021-05-02 01:08:00 +0000 UTC,UmF0aW5nLTM0Njc4MDU5,2,4,2,0.0,0.0,"Professor Gregory was not consistent for my class. She took many personal days and often came across as unorganized. When she is in the classroom, she tends to have good lectures. However, she waits to put grades in and is hard to reach by email.",Amazing lectures,,,Y,True,True,[],0,0
Natalie,Robertson,VGVhY2hlci00MDUzMzY=,History,Hampton University,HIS107,2021-07-26 23:00:37 +0000 UTC,UmF0aW5nLTM0OTg4MTc1,3,4,3,0.0,0.0,"Doesnt require textbook. Only 5 grades for the entire course. Attendance is graded. No Mid-term, no final, no tests and no quizzes. Pay attention to her lectures even though she gets off topic. Doesnt give extra credit. Doesnt address assignment questions, the answer is in the syllabus. Very by the book &amp; old-fashioned. Tough grader.",Lecture heavy--Graded by few things--Tough grader,,,Y,True,False,[],0,0
Natalie,Robertson,VGVhY2hlci00MDUzMzY=,History,Hampton University,HIS107,2021-06-24 17:11:36 +0000 UTC,UmF0aW5nLTM0OTM1Mzcw,1,2,1,0.0,0.0,Does not teacher the material well. Gets off topic easily and talks way too much and gets mad when people ask questions.,Lecture heavy,,,mandatory,True,False,[],0,0
Natalie,Robertson,VGVhY2hlci00MDUzMzY=,History,Hampton University,HIS107,2020-10-21 16:08:18 +0000 UTC,UmF0aW5nLTMzNzIwNjU0,1,1,1,0.0,0.0,"Robertson was not tech savvy and was stubborn so she wasn&#39;t tryna hear anyone&#39;s suggestions. Every one of my assignments with her was marked late because she thought I was lying about my email not working. Even after speaking to all the tech people at Hampton and they spoke to her, she still refused to change my grades. Thankfully I passed despite.",Clear grading criteria--Lecture heavy--Tough grader,,B+,mandatory,True,True,[],0,0
