firstName,lastName,teacherId,department,schoolName,class,date,reviewId,clarityRating,difficultyRating,helpfulRating,wouldTakeAgain,textbookUse,comment,ratingTags,teacherNote,grade,attendanceMandatory,isForCredit,isForOnlineClass,thumbs,thumbsDownTotal,thumbsUpTotal
Darlene,Taylor,VGVhY2hlci0yNDU2ODI4,English,Hampton University,ENG101,2019-01-16 03:51:13 +0000 UTC,UmF0aW5nLTMxMjY2OTkw,4,2,4,1.0,0.0,Good professor. Did 4 essays overall and a couple other writing assignments. No tests at all. She never gave anyone lower than an 85 on all assignments and papers. Easy A if you show up and participate. Only bad thing is she doesn&#39;t provide feedback on assignments,Participation matters--GRADED BY FEW THINGS,,A+,mandatory,True,False,[],8,14
Virgelia,Banks,VGVhY2hlci0yNTA5NTYx,Communication,Hampton University,COM103,2021-07-26 23:05:31 +0000 UTC,UmF0aW5nLTM0OTg4MTgy,4,2,4,1.0,5.0,Shes late every day. Textbook is required because you need access code &amp; chapters for daily reading. After each chapter theres a post test taken online. They are hard and tough to pass but your speeches hold more weight. Strict business pro attire for speeches required. The final is an essay test &amp; all post test combined in another online format,Gives good feedback--EXTRA CREDIT--Get ready to read,,,Y,True,False,[],0,0
Virgelia,Banks,VGVhY2hlci0yNTA5NTYx,Communication,Hampton University,COM103,2019-08-08 02:04:44 +0000 UTC,UmF0aW5nLTMyMTU2NDM3,4,3,4,1.0,5.0,"Class was textbook+online software with textbook company. After each chapter we read, we would have to take a post test online. Our final was online as well and consisted of a combination of all the post test questions. Speeches are a very important part of this course and you are required to wear strict business attire.",Accessible outside class--EXTRA CREDIT--Tough grader,,A+,mandatory,True,False,[],0,0
Ridha,Moussa,VGVhY2hlci0yNTM0MzE5,Mathematics,Hampton University,MAT130,2019-11-07 04:50:15 +0000 UTC,UmF0aW5nLTMyMzczOTA5,5,2,5,1.0,0.0,"Dr. Moussa was an amazing professor for Calculus 130. Before every test, he would dedicate an entire day for review which was essentially questions that were on the exam. Actually cares about his students and wants you to pass.",Gives good feedback--Amazing lectures--Caring,,A,mandatory,True,False,[],0,0
Richard,Dixon,VGVhY2hlci0yNTUyMTIy,Psychology,Hampton University,PSY346,2019-12-21 07:12:56 +0000 UTC,UmF0aW5nLTMyNzM2ODMy,5,3,5,1.0,5.0,Hands Down one of the best professors Ive had at hampton so far !! I highly recommend him to everyone he gives out tons of extra credit opportunitys you just have to come to class because it could be random.,Accessible outside class--Caring--EXTRA CREDIT,,A-,mandatory,True,False,[],0,0
Richard,Dixon,VGVhY2hlci0yNTUyMTIy,Psychology,Hampton University,PSY346,2019-12-10 22:51:59 +0000 UTC,UmF0aW5nLTMyNTk4NjQ2,5,3,5,1.0,5.0,"Dr. Dixon is an amazing professor! The best professor I&#39;ve had at Hampton so far. Very nice, and explains concepts thoroughly. He is younger, which helps him be more relatable and interesting. He gives extra credit opportunities, and will only test you on things discussed in class. 10/10 would recommend.",Accessible outside class--Inspirational--EXTRA CREDIT,,A+,non mandatory,True,False,[],0,0
Ronald,White,VGVhY2hlci0yNTUyNDYz,Social Science,Hampton University,EDU302,2019-12-11 04:26:15 +0000 UTC,UmF0aW5nLTMyNjA0NzEx,5,4,5,1.0,0.0,He is such a great human being and professor. His lectures are so interesting it almost isn&#39;t even like a lecture. There is no real book reading because his lectures and handouts are very specific. Test are always open note. He is very real with his personality and funny. Grab a seat and sit in the front as I did and enjoy the class.,Skip class? You won't pass.--Hilarious--Amazing lectures,,A,mandatory,True,False,[],0,0
Kermit,Crawford,VGVhY2hlci0yNTUyNjI5,Psychology,Hampton University,PSY404,2019-12-11 14:39:03 +0000 UTC,UmF0aW5nLTMyNjA4MTcx,1,5,1,0.0,0.0,This class is an elective and the ONLY thing he grades is exams which is not good especially for people who are not good testers like me. Did not give out study guides and tests were not straightforward. Participation points didn&#39;t help much. Did not give extra credit and doesn&#39;t curve. Hardest class I have ever taken at Hampton!,Graded by few things--Test heavy--Lecture heavy,,D+,mandatory,True,False,[],0,0
Christopher,Kozak,VGVhY2hlci0yNTUzMTc5,Fine Arts,Hampton University,HUM201,2020-10-30 15:25:29 +0000 UTC,UmF0aW5nLTMzNzUxNzU0,5,3,5,1.0,5.0,he is very accomadating for the online semester. The classes were pre recorded so you did it on your own time. He is very easy to get a hold of inside and outside of class. He was a great teacher highly recommend,Respected--Accessible outside class--Clear grading criteria,,B+,mandatory,True,True,[],0,0
Christopher,Kozak,VGVhY2hlci0yNTUzMTc5,Fine Arts,Hampton University,HUM201,2020-08-17 15:19:06 +0000 UTC,UmF0aW5nLTMzNTkyMzk4,5,2,5,1.0,5.0,He is very kind. He knows his information and he is funny which makes his class relieving to go to. I enjoyed his class a lot last year. He is patient and he tries his best to give you everything you need to succeed. Highly recommend his class.,Respected--Clear grading criteria--Hilarious,,B+,mandatory,True,False,[],0,0
Christopher,Kozak,VGVhY2hlci0yNTUzMTc5,Fine Arts,Hampton University,HUM201,2020-02-27 15:01:24 +0000 UTC,UmF0aW5nLTMyOTM3MTAw,5,2,5,1.0,5.0,"He really helps his students succeed. The class isn&#39;t that complicated, but the post tests were very important. He offered extra credit. His attendance was usually through google forms, so you could honestly do it from anywhere!",,,B+,mandatory,True,False,[],0,0
Christopher,Kozak,VGVhY2hlci0yNTUzMTc5,Fine Arts,Hampton University,HUM201,2019-12-18 05:59:49 +0000 UTC,UmF0aW5nLTMyNzAxOTI4,4,2,4,1.0,5.0,Professor Kozak is really funny and makes the lecture more interesting than it actually is. Attendance is &#34;mandatory&#34; but he does online attendance. All assignments for this course are online. Easy class and a cool professor.,Clear grading criteria--Hilarious,,B+,non mandatory,True,False,[],0,0
Darryl,Dance,VGVhY2hlci0yNTc1NDQz,English,Hampton University,ENG101,2020-02-27 15:03:29 +0000 UTC,UmF0aW5nLTMyOTM3MTA1,2,1,2,1.0,0.0,I had this class M/W/F at 8am. Worst mistake. The class moved very slow.. Everyone was as quiet as a mouse. The class was very very easy. Just do the assignments and you&#39;re good!,,,A,mandatory,True,False,[],0,0
Sherrie,Mitchell,VGVhY2hlci0yNTk5ODcy,Mathematics,Hampton University,MATH110,2020-09-26 05:21:43 +0000 UTC,UmF0aW5nLTMzNjYzODUy,5,3,5,1.0,0.0,I loved Ms Mitchell. She really cares about her students. she not only cared about math but she cared for her students well being. if you go to her office hours she will help you will anything. She is a very fair teacher and she does not want to see anyone fail but you must do your work. She also offers extra credit,,,B+,mandatory,True,False,[],0,0
Gerald,Hall,VGVhY2hlci0yNjM5OTUw,Business,Hampton University,MGT400,2020-11-18 18:57:38 +0000 UTC,UmF0aW5nLTMzODQxODIx,3,3,3,0.0,0.0,"He WILL take attendance serious and he will expect you to talk during class. If your an introvert, you might want to look for a different professor because he will call you out on it. Overall I just felt like he was inconsiderate and rude at times which was uncalled for. His quizzes and test are easy tho but expect one every week.",Participation matters--Skip class? You won't pass.--Group projects,,A,mandatory,True,True,[],0,0
Jerry,Bracey,VGVhY2hlci0xOTYwMTUy,Music,Hampton University,MUS121,2020-11-21 14:56:12 +0000 UTC,UmF0aW5nLTMzODY0OTU5,1,3,1,0.0,5.0,"The worst professor Ive ever had. Literally. Save yourself if you have to take a class with this man. He doesnt know how to teach the content in the curriculum &amp; is not a nice person overall. Very aggressive with a fragile ego, he has many complaints with the school &amp; they refuse to reprimand him for his wrongful actions towards students.",Participation matters,,A,mandatory,True,False,[],0,0
Jerry,Bracey,VGVhY2hlci0xOTYwMTUy,Music,Hampton University,MUS121,2017-01-03 23:25:59 +0000 UTC,UmF0aW5nLTI3NjY3MDUx,1,3,1,0.0,0.0,"I love music but this teacher made it seem so bad. He was seriously condescending and rude to the students, often making snide remarks about how if we couldn&#39;t handle it, we shouldn&#39;t be music majors. I passed but I hated the class and really disliked the teacher",Tough Grader--BEWARE OF POP QUIZZES--SO MANY PAPERS,,A+,,True,False,[],0,1
Jerry,Bracey,VGVhY2hlci0xOTYwMTUy,Music,Hampton University,MUS121,2016-10-24 14:20:22 +0000 UTC,UmF0aW5nLTI3MDcwODc4,1,5,1,0.0,5.0,"Professor Bracey is not concerned about anything but excellence in his classroom, but fails to provide quality teaching and instruction. He often goes off on tangents and is very hard to follow. He is not interested in explaining material further for clarification. Practice everyday and get the textbook and workbook ASAP!!!!!!!",Skip class? You won't pass.--LOTS OF HOMEWORK--TEST HEAVY,,Incomplete,mandatory,True,False,[],0,0
Jerry,Bracey,VGVhY2hlci0xOTYwMTUy,Music,Hampton University,MUS121,2016-06-13 14:50:04 +0000 UTC,UmF0aW5nLTI2NzIxNDU3,2,4,2,0.0,5.0,"Take whatever precautions you can to avoid this man. Not only is he naive, he is a broken record, keeps repeating that if we don&#39;t do our homework, we&#39;ll fail. He&#39;s cool as a person, but a teacher, forget about it.",,,B-,mandatory,True,False,[],0,1
Jerry,Bracey,VGVhY2hlci0xOTYwMTUy,Music,Hampton University,MUS121,2016-03-14 19:38:21 +0000 UTC,UmF0aW5nLTI2MTQyODQw,1,5,1,,5.0,Not a good teacher at all,,,,,True,False,[],0,0
Jerry,Bracey,VGVhY2hlci0xOTYwMTUy,Music,Hampton University,MUS121,2015-12-21 16:21:00 +0000 UTC,UmF0aW5nLTI1NzkyNDMx,1,3,1,,1.0,"Hampton should be ashamed of itself to have this man as a Professor in the Music Dept. He is either unwilling or unable to prepare students for the subsequent theory class. Even worse, he can be petty and immature. I received a good grade, so this is not revenge; just fact.",,,,mandatory,True,False,[],0,0
Jerry,Bracey,VGVhY2hlci0xOTYwMTUy,Music,Hampton University,MUS12101,2015-08-14 16:14:49 +0000 UTC,UmF0aW5nLTI1MTIxMzM1,4,2,4,,5.0,A great teacher!!!,,,A,mandatory,True,False,[],0,0
Jerry,Bracey,VGVhY2hlci0xOTYwMTUy,Music,Hampton University,MUSIC121,2015-04-08 16:32:57 +0000 UTC,UmF0aW5nLTI0NTYzMzAw,1,5,1,,5.0,"He was absolutely terrible!! Good person outside of class, and not to bash him or anything, but in class he had some screws loose. He expects you to use the textbook to learn the majority of the information and will assign a big project in the beginning of the semester that is due by the end of the semester. I changed my major because of this guy. ",,,,,True,False,[],0,0
Jerry,Bracey,VGVhY2hlci0xOTYwMTUy,Music,Hampton University,MUS121,2015-02-02 10:00:29 +0000 UTC,UmF0aW5nLTI0MzUyMTg2,1,5,1,,3.0,The worst teacher I have ever seen!  Avoid like the plague.,,,Rather not say,mandatory,True,False,[],0,0
Jerry,Bracey,VGVhY2hlci0xOTYwMTUy,Music,Hampton University,FRESHMANTHEORY,2014-12-11 08:15:06 +0000 UTC,UmF0aW5nLTI0MDMxNTE0,1,4,1,,3.0,This man is the worst theory tracher. I&#39;m not sure he knowsaid what he&#39;s talking about.  You will have to study alone and seek outside help or the following theory classes (i.e. Stokes) will be hell.  Hopefully the school will find someone knowledgeable of theory to teach this class ASAP!,,,,,True,False,[],0,1
Melissa,Gomes,VGVhY2hlci0yNjQyNDg0,Nursing,Hampton University,NUR221,2020-11-23 22:58:29 +0000 UTC,UmF0aW5nLTMzODc3MTM0,2,4,2,0.0,5.0,"Gomes doesnt communicate at all with the class, which makes understanding instructions unnecessarily difficult for students. The work is easy, but she has us do 3 group assignments, which are unnecessary as well. Overall she needs to have better communication, I wouldnt take her again.",Group projects,,,N,True,False,[],0,0
Jonathan,Romero,VGVhY2hlci0yMzM5MzA1,Nursing,Hampton University,BIO225,2020-11-24 00:58:58 +0000 UTC,UmF0aW5nLTMzODc4MDYz,1,3,1,0.0,5.0,"Romero has been one of the worst professors I&#39;ve had. He punishes students for not attending lecture (even though there&#39;s NO ATTENDANCE POLICY), makes false promises to his classes, and constantly gets off topic from what the course SHOULD be teaching. If you can avoid him for class, do it. Cool dude outside class, bad professor in class.",Lots of homework--Skip class? You won't pass.,,B,,True,False,[],0,0
Jonathan,Romero,VGVhY2hlci0yMzM5MzA1,Nursing,Hampton University,BIO224,2019-10-29 19:01:05 +0000 UTC,UmF0aW5nLTMyMzMxOTkz,5,3,5,1.0,5.0,He&#39;s a wonderful professor that will go out of his way to make sure you understand the material. Take him if you have the chance.,Respected--Lots of homework--Amazing lectures,,A+,non mandatory,True,False,[],0,0
Jonathan,Romero,VGVhY2hlci0yMzM5MzA1,Nursing,Hampton University,BIO225,2019-05-13 22:39:19 +0000 UTC,UmF0aW5nLTMxODYyMjM0,4,3,4,1.0,0.0,I truly enjoyed this class. He has a great way of explaining difficult concepts. He gets a little off topic sometimes but you truly learn lot in his class. The test are straight forward if you take notes and study what he highlights in class. His class was fun and he made sure all the students understood the material.,Accessible outside class--Inspirational--Amazing lectures,,A,non mandatory,True,False,[],0,0
Jonathan,Romero,VGVhY2hlci0yMzM5MzA1,Nursing,Hampton University,NUR307,2018-01-24 03:11:08 +0000 UTC,UmF0aW5nLTI5NDk2MzA1,5,4,5,1.0,5.0,comes across as really caring about whether or not his students do well.,Participation matters--Hilarious--Amazing lectures,,,mandatory,True,False,[],0,1
Michelle,Waddell,VGVhY2hlci0xODAxNjIy,Chemistry,Hampton University,CHE201,2020-11-24 04:20:47 +0000 UTC,UmF0aW5nLTMzODc5NDYz,2,4,2,0.0,5.0,"Professor Waddell is not the bestteacher for a subject as difficult as organic chemistry. She reads directly off the slides and doesn&#39;t sound confident in her knowledge about the material. We had a quiz every week and a test about every 2-3 weeks which was unreasonably timed. When we brought up the lack of time, she ignored our concerns. 0/10",Lots of homework--Test heavy--Lecture heavy,,B,mandatory,True,True,[],0,0
Michelle,Waddell,VGVhY2hlci0xODAxNjIy,Chemistry,Hampton University,CHE301,2020-11-05 16:51:59 +0000 UTC,UmF0aW5nLTMzNzczNzY3,1,4,1,0.0,5.0,"Dr. Waddell doesn&#39;t teach the material, she reads directly off the slides. She assigns an intense amount of work in a small timeframe, doesn&#39;t allow enough time to take tests, and she is inconsiderate as well. She has been very unaccommodating during this pandemic. I did not enjoy her class at all. She&#39;s rude too. Don&#39;t take her class!!!",Lots of homework--Get ready to read,,B+,mandatory,True,True,[],0,1
Michelle,Waddell,VGVhY2hlci0xODAxNjIy,Chemistry,Hampton University,CHE201,2019-11-07 20:53:53 +0000 UTC,UmF0aW5nLTMyMzc4MjE0,1,3,1,0.0,5.0,"If you dontt already know the material I recommend ANYBODY else. She shows up late to class and quizzes are nothing like the test. The way she teaches is like a review session. She doesnt teach she just talks. I would never recommend her class to anyone. If you take her read the book, get a tutor, and talk to people in other chemistry sections.",,,,N,True,False,[],0,0
Michelle,Waddell,VGVhY2hlci0xODAxNjIy,Chemistry,Hampton University,CHE201,2019-11-07 04:39:07 +0000 UTC,UmF0aW5nLTMyMzczODI1,2,4,2,0.0,5.0,Avoid taking her at all costs. As MANY of the other reviews say.. she reads directly from the powerpoint for notes and doesnt really teach. She also doesnt explain very well. I had to teach myself for the entire semester.,Get ready to read,,B+,non mandatory,True,False,[],0,0
Michelle,Waddell,VGVhY2hlci0xODAxNjIy,Chemistry,Hampton University,LAB201,2018-08-17 17:15:49 +0000 UTC,UmF0aW5nLTMwNDQxNzQ1,3,4,3,1.0,0.0,She does her best to help you understand the material. A lot of the material is difficult and it can get overwhelming,Tough Grader--TEST HEAVY,,C,mandatory,True,False,[],0,0
Michelle,Waddell,VGVhY2hlci0xODAxNjIy,Chemistry,Hampton University,CHEM202,2017-05-21 20:58:49 +0000 UTC,UmF0aW5nLTI4MzU4MzM5,3,4,3,0.0,5.0,Don&#39;t take her for lab. She&#39;ll critique your lab reports way too hard by taking off so many points for the silly things like not signing your name or forgetting to put the date. Her recitation quizzes aren&#39;t that bad but you would be better getting another professor for lab.,Tough Grader,,,,True,False,[],0,2
Michelle,Waddell,VGVhY2hlci0xODAxNjIy,Chemistry,Hampton University,CHEM201,2017-01-17 10:09:00 +0000 UTC,UmF0aW5nLTI3NzQxMjMw,1,4,1,0.0,5.0,Do not take this class if you aren&#39;t already good at chem. SHE WILL FAIL YOU. She gives no extra credit and doesn&#39;t care if you pass. Her test are nothing like the lectures. you need to teach yourself to pass this class,Tough Grader--ACCESSIBLE OUTSIDE CLASS--GRADED BY FEW THINGS,,B,mandatory,False,False,[],0,0
Michelle,Waddell,VGVhY2hlci0xODAxNjIy,Chemistry,Hampton University,CHE201,2016-11-02 11:20:33 +0000 UTC,UmF0aW5nLTI3MTEzODY0,3,4,3,1.0,5.0,"She doesn&#39;t really teach that well but she is nice. She goes directly off of powerpoints. If you take her, TAKE NOTES BEFORE CLASS (they&#39;re posted on Blackboard). Read the chapters so you can ask questions while in class. Ask for help from her or others.",Get ready to read--Clear grading criteria,,,non mandatory,True,False,[],0,0
Michelle,Waddell,VGVhY2hlci0xODAxNjIy,Chemistry,Hampton University,CHE201,2016-10-21 16:35:55 +0000 UTC,UmF0aW5nLTI3MDY0MDAy,1,3,1,0.0,5.0,she reads directly off of the powerpoint she puts on blackboard but doesn&#39;t really teach. she expects you to know what she knows. online quizzes are easy to look up,Tough Grader--Get ready to read--Skip class? You won't pass.,,C+,mandatory,True,False,[],0,4
Michelle,Waddell,VGVhY2hlci0xODAxNjIy,Chemistry,Hampton University,CHE201,2014-01-21 10:28:10 +0000 UTC,UmF0aW5nLTIyNzc2MzYx,1,4,1,,5.0,Do not take Dr. Waddell as a teacher unless you took chemistry in high school   I suggest you have a firm understanding because Waddell reads off a power point without trying to explain. There were about 35 people in my 201 class last semester about 12 are currently in 202. It&#39;s not impossible to pass just much harder than it should be.,,,B,Y,False,False,[],0,2
Michelle,Waddell,VGVhY2hlci0xODAxNjIy,Chemistry,Hampton University,CHEM201,2013-03-11 15:44:13 +0000 UTC,UmF0aW5nLTIxNDAxOTk1,2,3,4,,5.0,"My fault for failing. To succeed, you should: 1)Read chapters ahead of class, and add on to personal notes from her lectures. 2) Download her powerpoints and follow along in class, or review them at home. 3) DO the Hw (Worth a big chunk). 4) Ask for help from her or anybody. 5) Ask around for previous exams to help study (Not to cheat).",,,,,False,False,[],0,2
Abiodun,Adibi,VGVhY2hlci0yNTkzNDUz,Biology,Hampton University,BIO301,2020-11-24 04:23:32 +0000 UTC,UmF0aW5nLTMzODc5NDg2,4,2,4,0.0,0.0,Dr. Adibi lectures a lot and assigns minimal work. He is a tough grader and doesn&#39;t always give clear criteria for what he&#39;s looking for; he takes off measly little points on things he never explained. The tests are pretty easy.,Gives good feedback--Lecture heavy--Tough grader,,A-,mandatory,True,True,[],0,0
Abiodun,Adibi,VGVhY2hlci0yNTkzNDUz,Biology,Hampton University,BIO304,2020-05-05 02:40:50 +0000 UTC,UmF0aW5nLTMzMjAzMTI4,3,4,3,1.0,0.0,"Overall he is a great teacher, make sure you go to class because he gives &#34;pop&#34; assignments. He grades fairly and the lab sections are pretty fun. Make sure to stay on top of your work and everything will be fine.",Respected--Participation matters--Hilarious,,C+,mandatory,True,False,[],0,0
John,Burnett,VGVhY2hlci0yNDM2MDkz,Business,Hampton University,CSOO170,2020-12-09 19:06:00 +0000 UTC,UmF0aW5nLTM0MDAyMzE3,5,4,5,1.0,5.0,Excellent instructor who provides a sound critique. I would definitely take classes from him again.,Gives good feedback--Respected--Participation matters,,A,mandatory,True,True,[],0,0
John,Burnett,VGVhY2hlci0yNDM2MDkz,Business,Hampton University,MGMO3201,2018-12-05 15:35:42 +0000 UTC,UmF0aW5nLTMwODc4MzY5,5,5,5,1.0,5.0,"He was the top professor that I had during either undergrad or my MBA. He was very demanding but did it in the most professional manner. To this day, I look forward to reading his opinions on business matters.",Tough Grader--Gives good feedback--Respected,,A,,True,True,[],0,0
Amee,Carmines,VGVhY2hlci0zODUxMjg=,English,Hampton University,ENG300,2020-12-10 16:57:35 +0000 UTC,UmF0aW5nLTM0MDE2Nzg3,5,5,5,1.0,5.0,"As a doctoral student, I credit Dr. Carmines for making me aware of hermeneutics. It allows me to establish theoretical frameworks to perform research, put on a theoretical lens for data analysis with my qualitative or quantitative research, or, more traditionally (I would say), perform critical analysis of someone else&#39;s data or research.",Hilarious--Gives good feedback--Respected,,A-,mandatory,True,False,[],0,0
Amee,Carmines,VGVhY2hlci0zODUxMjg=,English,Hampton University,ENG102H,2020-11-11 21:24:03 +0000 UTC,UmF0aW5nLTMzODAyMjM2,3,5,3,0.0,0.0,She gives a 12-15 page paper due and the final is another essay. Honestly she isnt a bad teacher but the curriculum is a LOT. There is a lot of unnecessary work but she is still a decent teacher.,Tough grader--Get ready to read--Skip class? You won't pass.,,,Y,True,False,[],0,0
Amee,Carmines,VGVhY2hlci0zODUxMjg=,English,Hampton University,ENG499,2019-02-15 01:26:48 +0000 UTC,UmF0aW5nLTMxMzU4NTgz,5,5,5,1.0,5.0,"Tough. Fair. Most difficult educational experience, but most beneficial.",Respected--Get ready to read--Tough grader,,A,mandatory,True,False,[],0,0
Amee,Carmines,VGVhY2hlci0zODUxMjg=,English,Hampton University,ENG102H,2017-11-07 16:26:14 +0000 UTC,UmF0aW5nLTI4ODUxOTY1,4,4,4,0.0,5.0,"She is really nice and a good teacher but make sure you&#39;re prepared, her final research paper is based on your major and is 12-15 pages. If you&#39;re not a good writer or just feel as if you can&#39;t do it then don&#39;t.",Get ready to read--Skip class? You won't pass.--SO MANY PAPERS,,,mandatory,True,False,[],0,0
Amee,Carmines,VGVhY2hlci0zODUxMjg=,English,Hampton University,ENG102H,2016-12-19 15:01:46 +0000 UTC,UmF0aW5nLTI3NTY3MTkz,3,4,3,0.0,5.0,"Really nice lady but the class is a lot of work. 12-15 page research paper as a freshman, also 5-7 pg literary analysis.",Tough Grader--Gives good feedback--BEWARE OF POP QUIZZES,,B+,mandatory,True,False,[],0,1
Amee,Carmines,VGVhY2hlci0zODUxMjg=,English,Hampton University,ENG102H,2016-04-28 21:39:38 +0000 UTC,UmF0aW5nLTI2NDEwOTM3,2,4,4,,5.0,Dr. Carmines is a HARD teacher! I had her for honors Eng and she does not get hard until after you cant drop the class anymore! Her research paper was 12-15 papers while other honors teachers was only 7-9. DO NOT TAKE HER if you&#39;re on merit scholarship. All in all  be prepared to WORK HARD in her class and go to her office hours for every paper. GL,,,,mandatory,True,False,[],0,3
Amee,Carmines,VGVhY2hlci0zODUxMjg=,English,Hampton University,ENG102,2016-04-06 12:13:23 +0000 UTC,UmF0aW5nLTI2MjQwOTU1,3,4,4,,3.0,"Dr. Carmines is a very sweet lady, but be ready to work in her class. She assigns long research papers but she is very open to questions. Her class tends to be very boring though. I wouldn&#39;t suggest that you drop the class if you have her, she will definitely make you a better writer.",,,,non mandatory,True,False,[],1,0
Amee,Carmines,VGVhY2hlci0zODUxMjg=,English,Hampton University,CSC102,2015-10-21 01:14:36 +0000 UTC,UmF0aW5nLTI1Mjc0MTQ0,1,4,2,,3.0,"Sweet lady but boring, she&#39;s extremely vague in her topic assignments, and tends to go on rants. She only helps during office hours.",,,B+,mandatory,True,False,[],0,1
Amee,Carmines,VGVhY2hlci0zODUxMjg=,English,Hampton University,23382,2015-04-14 13:18:44 +0000 UTC,UmF0aW5nLTI0NTkyODcw,1,4,2,,3.0,She is not clear on when work is due and needs to be turned in. One date may be on Blackboard and she will tell you another date in class. She also required a lot of work including an extensive research paper and presentation. She crams work and is not understanding.,,,B,mandatory,True,False,[],0,3
Amee,Carmines,VGVhY2hlci0zODUxMjg=,English,Hampton University,ENG102H,2014-01-12 21:31:55 +0000 UTC,UmF0aW5nLTIyNzQwNjky,5,4,5,,3.0,"She is a great teacher! She makes you WORK for you grade. I took her class last semester as a freshman. She is very intelligent &amp; I grew to really like her. I ended up with an A- in her class &amp; I was really happy. She is a teacher that actually makes you do your work and learn, if you do that, you&#39;ll be fine.",,,,,False,False,[],1,0
Amee,Carmines,VGVhY2hlci0zODUxMjg=,English,Hampton University,ENG102H,2013-12-18 22:51:15 +0000 UTC,UmF0aW5nLTIyNjA5Mjk3,3,4,4,,2.0,"Dr. Carmines was almost the death of me. Her class is hard especially if you are a freshmen. She gives a LOT of work and expects it to be done no matter what. However she is a great teacher. I learned how to write the perfect paper in her class and she surely taught me a valuable lesson in time management and work ethic. Overall, I survived her.",,,,,False,False,[],0,3
Amee,Carmines,VGVhY2hlci0zODUxMjg=,English,Hampton University,ENG300,2011-01-24 10:24:30 +0000 UTC,UmF0aW5nLTE4MTc0Mzc5,4,4,4,,5.0,best teacher in the english department,,,,,False,False,[],2,0
Amee,Carmines,VGVhY2hlci0zODUxMjg=,English,Hampton University,ENG102,2010-08-15 23:03:15 +0000 UTC,UmF0aW5nLTE3NTE1MzQ4,3,4,5,,5.0,She is a very wise professor. She knows her stuff. When you first get into her class you will think it is very hard but stick it out and study it will be for your good.,,,,,False,False,[],1,0
Amee,Carmines,VGVhY2hlci0zODUxMjg=,English,Hampton University,ENG499,2007-03-25 22:34:43 +0000 UTC,UmF0aW5nLTEyOTQyNjcy,5,5,5,,3.0,great!,,,,,False,False,[],1,0
